Column1,title,text,url
338763,"Kenya replaces tainted police chief after abuse allegations by UN, rights groups","[""NAIROBI, Kenya (AP) - President Mwai Kibaki has fired Kenya's police commissioner, whose officers are accused of having committed executions and rapes, in a shuffle that drew praise from human rights activists."",""Human rights campaigners welcomed the firing of Mohammed Hussein Ali but said it was only a small step in reforming the security forces."",""Six years ago, Ali was brought in to clean up the police but did little to tackle a culture of corruption and abuse. The U.N. alleged the gray-haired, mustachioed police commissioner even ran death squads after the bodies of hundreds of young men were found dumped at morgues and other sites during a crackdown on a banned gang. Many were last seen in police custody."",""Human Rights Watch and the state-funded Kenya National Commission on Human Rights say police also looted and raped and killed Kenyans during weeks of riots that followed the contested December 2007 elections, in which more than 1,000 people died."",""Ali, who next heads the country's postal service, denied the allegations."",""\""Unfortunately during my tenure vilification of police became a national pastime,\"" he said. \""Police work is not a public relations exercise.\"""",""Ali was replaced by Mathew Kirai Iteere, the former head of the police paramilitary General Service Unit, a government statement announced, without giving a reason for Ali's dismissal. Iteere's unit has also been blamed for some abuses."",""The poorly paid police are heavily armed but have little investigative capacity and are easily bribed with kitu kidogo -- Swahili for \""something small.\"""",""Leslie Lefkow, a senior researcher in the Africa division at Human Rights Watch, said those who committed abuses must be held accountable and that a special tribunal should be set up to investigate abuses committed during the election period."",""\""This is a welcome first step but we need to see a host of measures by the Kenyan government to address the widespread abuses by the Kenyan security forces,\"" she said."",""A U.N. panel in February called for Ali's resignation."",""\""Killings by the police in Kenya are systematic, widespread and carefully planned,\"" it said. \""They are committed at will and with utter impunity.\"""",""Harun Ndubi, a director of Kenyan civil rights group Haki Focus, said appointing a new chief without instituting wide-ranging reforms is akin to \""changing the furniture in a condemned house whose walls are meant to be knocked down.\"""",""The police have repeatedly denied committing rights abuses or extrajudicial killings."",""Two activists who tracked the gang-related killings were shot dead a few minute's walk from the house of the president earlier this year. A police whistleblower who provided information to the national human rights body was also shot dead. The killings have yet to be solved."",""------"",""Associated Press Writer Katharine Houreld contributed to this report.""]","ap.com/Kenya replaces tainted police chief after abuse allegations by UN, rights groups"
240720,"Saudi King sacks General Al-Bunyan, other  commanders","[""Saudi King Salman on Monday night, in a major shake-up of the kingdoms defence establishment sacked  top military commanders including the chief of staff, General Abdul Rahman bin Saleh al-Bunyan,  state media said."",""In a series of late-night decrees, the monarch immediately replaced the heads of the ground forces and air defences, as well as civilian officials including several deputy ministers."",""While Al-Bunyan was then appointed Royal Court Adviser at the rank of General, Gen. Fayyadh Al-Ruwaili was appointed as chief of staff. Lieutenant General Fahd bin Turki was appointed commander of Saudi Arabias joint forces."",""No official reason was given for the sweeping overhaul, but it comes as Crown Prince Mohammed bin Salman pursues military reform and a bloody campaign against Yemens Iran-aligned Huthi rebels nears the end of its third year."",""Termination of the services of General Abdul Rahman bin Saleh al-Bunyan, Chief of Staff, the official Saudi Press Agency (SPA) announced, adding that Fayyad al-Ruwaili had been appointed as his replacement."",""Al-Bunyan was retired after he inaugurated an arms exhibition this week in Riyadh by the Saudi Arabian Military Industries (SAMI), the state-owned defence company, which has drawn several global defence firms."",""A military transformation is underway in Saudi Arabia, Theodore Karasik, a senior advisor at the consultancy Gulf States Analytics, told AFP."",""The changes come on the heels of the SAMI exhibition, which is a critical part of the Prince Mohammeds reform plan to create an indigenous defence program, he added,"",""Crown Prince Mohammed, the son of the monarch and heir to the throne, is the countrys defence minister and has been consolidating his grip on power in recent months while pushing major economic and social reforms."",""The young prince has pursued an assertive regional policy, including leading a military intervention in neighbouring Yemen since 2015 that is seen as a proxy war with arch-rival Iran."",""The Yemen conflict has led to what the UN describes as the worlds worst humanitarian crisis."",""More than 9,200 people have been killed in the conflict and another nearly 2,200 Yemenis have died of cholera, according to the World Health Organization."",""King Salman also decreed a series of civilian appointments that saw younger officials being elevated to key positions as deputy ministers, deputy provincial governors and royal court advisors."",""Tamadar bint Yousef al-Ramah was appointed the deputy minister of labour and social development, a rare senior government post for a woman in the conservative kingdom."",""Prince Turki bin Talal, the brother of billionaire Prince Al-Waleed bin Talal, was appointed deputy governor of the southern Assir Province."",""Prince Al-Waleed, dubbed the Warren Buffett of Saudi Arabia, was among princes, ministers and tycoons detained in Riyadhs luxury Ritz-Carlton hotel in an unprecedented crackdown on what the government calls elite corruption."",""The Ritz-Carlton reopened for business on February 11, more than three months after becoming a gilded prison for Saudi elites."",""*Reuters ""]",nan.ng/news/saudi-king-sacks-general-al-bunyan-commanders
304031,CCT orders forfeiture of money in Onnoghen’s account,"[""The Code of Conduct Tribunal on Thursday ordered the forfeiture of all money in the account of the suspended Chief Justice of Nigeria, Justice Walter Onnoghen, which he did not declare."",""Delivering ruling, Justice Danladi Umar,  also banned Onnoghen from holding any public office for ten years."",""The CCT has ordered the removal of  Onnoghen as CJN and as chairman National Judicial Council.""]",vanguardngr.com/2019/04/cct-orders-forfeiture-of-money-in-onnoghens-account
99098,Three policemen dismissed over reckless shooting,"[""Three policemen attached to the Lagos State command have been dismissed for alleged reckless shooting."",""Police spokesman, Chike Oti, who broke the news, said: “The general public is, hereby, informed that three policemen attached to Amukoko Division, by names and service numbers: 25759 Sgt. Osaseri Saturday, 359075 Sgt. Segun Okun, and 496833 Corporal Adekunle Oluwarotimi, have been tried and dismissed from the Nigeria Police for breaching the rules of engagement, to wit reckless application of firearms."",""“The aforementioned non-commissioned officers committed the offence on January 11, 2018 at about 2130 hours, at Ifelodun Street, Amukoko, Lagos State, when they disproportionately responded with bullets fired from their weapons at some youths alleged to have hurled some non-ballistic missiles at them such as stones, sticks and bottles, leading to the death of one of the youths and injury of another.""]",guardian.ng/news/three-policemen-dismissed-over-reckless-shooting
129038,116 policemen suspended in Pakistan,"[""No fewer than 116 police officials have been suspended from their posts for their alleged involvement in June 2014 Model Town tragedy in Pakistan’s eastern Punjab province, local media reported."",""The suspended policemen included deputy superintendent of police, inspectors and investigation in-charge, said local Urdu TV channel ARY News on Wednesday."",""The media added that the removed officials have been directed to report to their respective headquarters for further orders."",""Earlier this month, anti-terrorism court in the country’s eastern city Lahore also indicted former Punjab Police Chief, Mushtaq Sukhera, over his role in Model Town tragedy."",""The official, however, denied all the allegations levelled against him."",""On June 17, 2014, at least 14 people, including two women, were killed when Punjab police allegedly opened fire on protestors of the Pakistan Awami Tehreek (PAT)."",""Around 100 workers also got injured in the clashes over removal of barricades outside the PAT secretariat in the Model Town area of Lahore."",""Travel ban: Negative consequences far outweighs whatever gain FG has in mind – NBA"",""Since then, PAT chief Tahir-ul-Qadri has been demanding justice in the case and seeking suspension of all policemen involved in the operation to conduct free and fair investigation in the case."",""On Sept. 27, Prime Minister, Imran Khan, had assured the PAT chief that strict action would be taken against those behind the Model Town tragedy."",""“The chief minister Punjab needs to ensure that action as per law was taken against all those responsible for the killings."",""“They need to be removed from their posts so that impartial legal action may proceed,” said the prime minister."",""NAN""]",vanguardngr.com/2018/10/116-policemen-suspended-in-pakistan
12995,Tanzania suspends port chiefs over cargo theft allegations,"[""DAR ES SALAAM (Reuters) - Tanzania has suspended the head of its ports authority and six other senior port officials over allegations of cargo theft and embezzlement of public funds, the transport ministry and local media said on Friday."",""The government is struggling to crack down on corruption in ministries and state institutions, with the public losing patience at the slow pace of change."",""Investors have long complained of graft as one of the main reasons for the high cost of doing business in east Africa’s second-biggest economy."",""Tanzania’s main port, in the commercial capital Dar es Salaam, which serves six landlocked countries, has often been dogged by allegations of inefficiency and corruption."",""It has been losing its market share of international cargo to other ports in the region like Kenya’s Mombasa and Mozambique’s Beira ports, the transport ministry says."",""Transport Minister Harrison Mwakyembe has suspended the director-general of the state-run Tanzania Ports Authority, Ephraim Mgawe, and his two deputies while an investigation is carried out, the ministry said in a statement on its website."",""The manager of the port’s aviation fuel depot, the head of the port’s oil jetty and the jetty’s engineer were also suspended, it said."",""Local media quoted Mwakyembe as saying that up 40 containers loaded with fabrics were reported stolen, and that port officials were under-declaring fuel quantities leaving the port."",""“Containers are being stolen like peanuts. Right now the people of Rwanda, Uganda and the Democratic Republic of Congo are no longer using Dar es Salaam and are going to Mombasa, Beira and Durban,” he was quoted as saying in newspaper Mwananchi."",""The suspended officials were not immediately available for comment."",""In one instance a container with goods worth $182,000 owned by a trader from the Democratic Republic of the Congo (DRC) was stolen, the state-run Daily News quoted Mwakyembe as saying."",""“It is alarming that containers are getting lost at the Dar es Salaam port, and as a result traders from neighboring countries are shunning our port ... we cannot keep quiet,” he said."",""The port serves Malawi, Zambia, the DRC, Burundi, Rwanda and Uganda, It handled 3.275 million metric tons of cargo from neighboring countries in 2011-12, up 106,000 metric tons from the previous year, according to data from the transport ministry."",""President Jakaya Kikwete sacked six ministers in May and several senior officials have been suspended in the past few months over graft allegations, including the head of the state-run power company in July."",""“Many government institutions have been underperforming and there have been graft allegations, yet no action has previously been taken,” Benson Bana, head of the University of Dar es Salaam’s political research think-tank, REDET, told Reuters."",""“We still have a long way to go to minimize corruption, especially in the public sector. People are now talking about grand corruption, it’s no longer the petty corruption of the past.”""]",reuters.com/article/us-tanzania-corruption-idUSBRE87N0OY20120824
32523,Uganda officers suspended over 'sex crimes',"[""Uganda has suspended 15 of its senior military commanders over their conduct in Somalia, including allegations ofsexual exploitation, the army said.The suspension on Thursday comes in the wake of a damning report by Human Rights Watch which has accused troops with the internationally funded African Union force in Somalia, AMISOM, of preying on vulnerable women and girls."",""Those are allegations. We are investigating. Until the investigations are completed that's when we will know their involvement [in sexual abuse], but for now they are suspended."",""- Paddy Ankunda, Army spokesperson"",""\""We are doing a general appraisal on performance of the force,\"" Uganda's defence and army spokesman Paddy Ankunda told the AFP news agency. \""It's not sexual harassment alone,\"" he said, but added the concerns were \""one aspect we are looking at\"".\""Those are allegations. We are investigating. Until the investigations are completed that's when we will know their involvement [in sexual abuse], but for now they are suspended,\"" he said.The 22,000-strong AMISOM force comprises soldiers drawn from six nations, and has been fighting alongside Somali government troops against al-Shabab fighters since 2007. AMISOM donors include the United Nations, European Union, Britain and the United States.The Human Rights Watch report quoted several women as saying they had gone to the AMISOM camp seeking medicine for their sick babies, but were then forced to have sex. The vulnerable women largely came from camps in the capital Mogadishu, having fled rural Somalia during a devastating famine in 2011. African Union chief Nkosazana Dlamini-Zuma has already ordered an investigation into the allegations, and the probe is due to be completed by November 30. The pan-African bloc, however, has also accused Human Rights Watch of being unfair and inaccurate, and of undermining peace efforts in the war-torn Horn of Africa nation.""]",aljazeera.com/news/africa/2014/11/uganda-officers-suspended-over-sex-crimes-20141169910343462
113348,Azerbaijan leader sacks security minister,"[""Azerbaijani President Ilham Aliyev on Saturday fired his powerful security minister in a surprise move that opposition politicians said highlights a lack of transparency in the tightly-controlled ex-Soviet nation’s political system."",""“I decree to relieve Eldar Mahmudov of the position of the Azerbaijani Republic’s national security minister,” Aliyev said in a decree published on his website, giving no explanation for the decision."",""Widely seen as Aliyev’s loyalist, Mahmudov, 59, has served as Azerbaijan’s national security minister since 2004."",""Prominent Azerbaijani opposition politician, Isa Gambar, said the way Aliyev fired the veteran minister shows that “there is no transparency whatsoever in political decision-making” in Azerbaijan."",""“What happened to Mahmudov shows yet again how opaque Azerbaijan’s political system is,” Gambar told AFP. “Aliyev sacks a key government minister without explanation, on his sudden whim.”"",""Leader of the opposition Popular Front party, Ali Kerimly, said: “Azerbaijan is an authoritarian country. Our president doesn’t bother about explaining his decisions to society.”"",""Critics have long accused Aliyev of authoritarianism, corruption, and rights abuses — claims he has furiously rejected."",""He took over in 2003 on the death of his father Heydar Aliyev, a former KGB officer and communist-era leader who had ruled newly-independent Azerbaijan with an iron fist since 1993.""]",guardian.ng/news/azerbaijan-leader-sacks-security-minister
398402,Sossion out! Letter from Registrar of Trade Unions says,"[""Wilson Sossion has been officially removed from office, a notice from the Registrar of Trade Unions on Friday revealed."",""The letter addressed to the Kenya National Union of Teachers (KNUT) reads:"",""I wish to inform you that I have registered the Notice of Change of Officers covering the appointment made on August 29, 2019."",""Lawyers representing Sossion have since responded warning the Registrar to withdraw the notice or face a lawsuit."",""A letter from J. A. Guserwa \u0026 Company Advocates warned that the Registrar would be cited for contempt as the meeting that announced the change was allegedly stopped."",""KNUT Chairman Wycliffe Omucheyi however maintained that Sossions suspension still stands and Hesbon Otieno Agola remains the unions acting Secretary General."",""Sossion was suspended in 2018 for ignoring a directive to respond to allegations of gross misconduct and show-cause-why."",""On Friday, Mr. Omucheyi said the National Executive Council had agreed to replace Sossion due to anomalies."",""He was seen to be running the office alone instead of with the steering committee. We advised him to work with us but he didnt, Mr. Omucheyi said."",""According to him, Sossion soured their relations with the government when he used bad language in reference to the Education CS George Magoha and Teachers Service Commission CEO Nancy Macharia."",""Also Read: Magoha bullish on CBC, warns teachers against Sossions boycott calls"",""He further accused Sossion of insulting the presidency by claiming an appointment was made by the roadside."",""The Chairman further rubbished claims that KNUT is a puppet of the government saying that if Sossion has issues with the State he should deal with them individually."",""We now urge TSC to pay us our deductions so that our operations can resume. We want a meeting with TSC so that we can have our teachers promoted, transfers considered, he said."",""He further called on the Ministry of Education to be open to discussions on the Competency Based Curriculum so that they can work together for it to succeed."",""Also Read: Stop teaching new curriculum, revert to 8-4-4  Sossion tells teachers""]",citizentv.co.ke/news/sossion-out-letter-from-registrar-of-trade-unions-reveals-274831/indexamp
334175,Burundi's Leader Fires Tutsi VP,"[""BUJUMBURA, Burundi (AP) - Burundi's Hutu president dismissed his Tutsi vice president Wednesday, but agreed to name a Tutsi replacement in an effort to save a fragile power-sharing agreement, officials said.  "",""President Domitien Ndayizeye accused Vice President Alphonse Kadege of undermining efforts to end Burundi's 11-year civil war by failing to support a constitutional referendum, presidential spokesman Pancrace Cimpaye said.  "",""A permanent constitution -- to replace an interim one that expired Nov. 1 -- is a key step in a peace agreement brokered in 2000. The peace deal also calls for the main Hutu and Tutsi parties to share the presidency and vice presidency. The dismissal of a key member of the most influential Tutsi party could undermine the deal.  "",""Tutsis -- who have mostly controlled Burundi's government and military since independence from Belgium in 1962 -- want the constitution amended, saying it favors Hutus. The charter divides power in government and parliament, giving 60 percent of seats to the majority Hutus and 40 percent to the minority Tutsis.  "",""Civil war broke out in Burundi in 1993 after Tutsi paratroopers assassinated the country's first democratically elected leader, a Hutu. The ensuing conflict between the Tutsi-dominated army and Hutu rebel factions claimed more than 260,000 lives, mostly civilians, in the country of about 6 million people.  "",""Ndayizeye agreed to appoint a new vice president from Uprona, the dominant Tutsi party in government, party spokesman Gerard Nduwaye said.  "",""\""They agreed to rebuild confidence and cooperation in government and political institutions in Burundi,\"" Nduwaye told The Associated Press. \""We don't want a political crisis. We want to go forward and to solve problems with other political parties.\""  "",""Tutsi leaders met Wednesday to choose a replacement, Nduwaye said. Ndayizeye will name the new appointee Thursday, but lawmakers must vote to ratify the choice, he said.  "",""Tutsi-led parties want constitutional guarantees that the Tutsi share in government will go to their parties, and not to Tutsi members of the Hutu-dominated parties expected to sweep legislative elections set for April.  "",""When the interim constitution expired, the legislature voted to let the draft charter take effect until Burundians vote Nov. 26 on whether to adopt it permanently.  "",""Kadege's declaration Monday that the referendum would not be held Nov. 26 as planned angered ethnic Hutus in government, including Ndayizeye.  "",""\""He was supposed to help the president but instead of helping him, he was undermining the head of state -- especially regarding the constitution,\"" Cimpaye said.  ""]",ap.com/Burundi's Leader Fires Tutsi VP
246114,Ogun Police arrest seven robbery suspects,"[""POlICEMEN attached to Joint Boarder Patrol, Ilaro, Ogun State have arrested seven suspected members of a robbery gang, among them a female, and recovered three locally -made pistols and eleven cartridges from them."",""The robbery suspects, as gathered, were on their way to a location they intended to carry out an operation when two suspected members of the gang were arrested."",""Spokesman for the Command, Mr Olumuyiwa Adejobi told Crime Alert that the duo of Saheed Idowu and Clement Falolu, were arrested on a motorcycle recently by the Joint Border Patrol policemen. They were reportedly subjected to a search where three locally-made single barrel guns and cartridges were recovered inside a bag they were carrying."",""Adejobi said the suspects “confessed to series of armed robbery incidents in Ilaro and Oja-Odan and its environs,” adding that their confessional statements later led to the arrest of five other suspected members of their gang identified as Ishola Saidat, Sesan Ayinla, Niniola Kamoru, Ogundipe Kehinde and Ezekiel Ishola .""]",vanguardngr.com/2011/10/ogun-police-arrest-seven-robbery-suspects
376694,Labour court reinstates Wilson Sossion as KNUT Secretary General,"[""A Nairobi court has reinstated embattled Wilson Sossion as Kenya National Union of Teachers (KNUT) Secretary General days after he was ousted from the union."",""The Employment and Labour Relations Court on Monday directed that Sossion be reinstated pending hearing and determination of a case in which he opposed his removal from office."",""At the same time, Sossion was allowed to access KNUT bank accounts."",""this Honourable court be pleased to issue and order of stay of the suspension of the Applicant by the Respondents directed against the Interested Party touching on the decision made on August 29, 2019 pending the hearing and determination of this suit, read the judgement."",""That the Honourable Court be pleased to order the status quo of the KNUT register of officials obtaining prior to August 29, 2019 to be maintained with regard to the operations o the KNUT Bank Accounts at Kenya Commercial Bank, Equity Bank and Standard Chartered Bank pending further orders of the Court."",""The embattled KNUT Secretary General was last week removed from office in a notice from the Registrar of Trade Unions."",""The letter, which was addressed to KNUT, read: I wish to inform you that I have registered the Notice of Change of Officers covering the appointment made on August 29, 2019."",""According to KNUT Chairman Wycliffe Omucheyi, the National Executive Council had agreed to replace Sossion due to anomalies."",""He was seen to be running the office alone instead of with the steering committee. We advised him to work with us but he didnt, Mr. Omucheyi said.""]",citizentv.co.ke/news/court-reinstates-wilson-sossion-as-knut-secretary-general-275073/indexutm_source=relatedarticles&utm_medium=deeplinking&utm_campaign=AlsoRead
