Column1,title,text,url
69187,Iraq prime minister sacks Baghdad security chiefs after deadly blast,"[""Iraqi Prime Minister Haider al-Abadi sacked the head of the Baghdad security command and other top officials after a bombing in the capital killed 292 people, his office said on Friday."",""Abadi issued “an order to relieve the Baghdad Operations commander of his position,” as well as removing officials responsible for intelligence and security in the capital, a statement said."",""The head of the Baghdad Operations Command was Lieutenant General Abdulamir al-Shimmari."",""An official in Abadi’s office said the others removed were the head of interior ministry intelligence for Baghdad and the official responsible for the capital in the national security adviser’s office."",""Iraq’s interior minister tendered his resignation after the bombing, one of the deadliest to ever hit Iraq, but the Friday statement was the first announcing that officials were fired following the attack."",""A suicide bomber detonated an explosives-laden minibus in a Baghdad shopping district early on Sunday as it teemed with people ahead of the holiday marking the end of the holy Muslim fasting month of Ramadan."",""The blast, which was claimed by the Islamic State jihadist group, killed 292 people."",""Authorities are still working to identify those killed in the attack, but Health Minister Adila Hamoud said on Thursday that the identities of 177 bodies had yet to be determined."",""The initial blast killed a limited number of people, but raging flames spread and trapped people inside shopping centres at the site that lacked emergency exits, police Major General Talib Khalil Rahi said."",""Interior Minister Mohammed Ghabban submitted his resignation following the bombing, and authorities also announced new security measures, the execution of five convicts and the arrest of 40 jihadists in an apparent bid to limit the fallout from the attack."",""Ghabban criticised the security system as fundamentally flawed, saying he could no longer accept responsibility for the consequences and calling for a series of changes that would ultimately increase the ministry’s power."",""An official in Abadi’s office told AFP on Wednesday that the premier had accepted the minister’s resignation, though there has been no official statement from him on the matter."",""IS overran large areas north and west of Baghdad in 2014, but Iraqi forces have since regained significant territory from the jihadists."",""In response to the battlefield setbacks, the Sunni extremist group has hit back against civilians, and experts have warned there may be more bombings as the jihadists continue to lose ground.""]",guardian.ng/news/iraq-prime-minister-sacks-baghdad-security-chiefs-after-deadly-blast
450112,Cameroon electoral agency boss Babale sacked,"[""Cameroon’s President Paul Biya has sacked the electoral commission ELECAM director-general, Mr Abdoulaye Babale."",""A presidential decree on Monday said Dr Erik Essouse would take over from Mr Babale, who has served for less than three years"",""Dr Essouse was until his appointment, the ELECAM deputy director-general."",""The change comes ahead of the presidential, parliamentary and local council elections expected later this year."",""Renewable mandate"",""In a separate decree, the Cameroonian leader appointed Mr Abdoul Karimou as deputy director-general of ELECAM. Both appointees have a five-year renewable mandate."",""Mr Babale's sacking comes barely two days after members of the electoral board accused him of gross mismanagement and other excesses at the poll agency."",""In a missive to President Biya following an extraordinary board meeting on Friday, members of the electoral board headed by former governor Enow Abrams Egbe, faulted the outgone director-general of \""opaque and calamitous management” of human, material and financial resources\""."",""The ruling regime"",""The board also frowned at Mr Babale's persistent absence; a behaviour that was affecting staff morale ahead of the elections."",""In a different letter to the president earlier, employees of the elections and referenda management body had accused Mr Babale of embezzling huge sums of money from the electoral body."",""ELECAM has been heavily criticised by opposition for lack of independence from the ruling regime."",""The 85-year-old President Biya has ruled Cameroon since 1982. He is currently serving his fifth seven-year mandate."",""The guide will help developing countries navigate the digital age."",""Treasury seeks additional funding of $866m, increasing the 2019/2020 budget to $30.4bn.""]",theeastafrican.co.ke/news/africa/Cameroon-poll-agency-boss-sacked/4552902-4585180-format-xhtml-6vlqfvz
317366,Uganda suspends officials in UN relief scandal,"[""Uganda said on Thursday it had suspended five officials, including a senior technocrat, following United Nations allegations of possible fraud in the management of relief aid to the country, home to about 1.5 million refugees."",""The allegations have drawn unusually pointed and public comments from foreign governments, including the US ambassador."",""Musa Ecweru, junior minister for relief and disaster preparedness, told Reuters the five officials suspended included Apollo Kazungu, a commissioner in the office of the prime minister who has been in charge of refugees."",""“Our zero-tolerance to corruption is not a slogan, we have asked the PS to get those suspected to step aside,” Ecweru said."",""Uganda said this week it had started an investigation into allegations that officials defrauded donors by inflating refugee numbers and diverting food aid."",""Refugees"",""The country hosts slightly more than one million refugees from South Sudan, where a raging civil war has left tens of thousands dead, economic ruin and mass displacement."",""South Sudan plunged into conflict in 2013 after political rivalry between President Salva Kiir and his then-deputy Riek Machar exploded into a military confrontation."",""About 400,000 additional refugees have also entered Uganda from Burundi, where political violence has killed hundreds of people, and from a deadly conflict in eastern Democratic Republic of Congo."",""As the South Sudan conflict escalated, Uganda was widely praised for opening its doors without any restrictions and received substantial inflows of aid as donors responded to desperate appeals for help."",""Fraud allegations"",""But allegations of possible theft of these funds have unsettled donors. Both the European Union and United States have call for urgent investigations to establish what went wrong."",""The EU has asked its own anti-fraud office to conduct a separate investigation."",""US ambassador Deborah R. Malac said Uganda needed to conduct investigations urgently, ensure the restitution of any lost funds and prosecute anyone found to be involved in fraud. Failure to act would make it hard for governments to trust Uganda as a partner, she said."",""“We cannot stress enough the fierce urgency for swift and definitive action,” she said at a meeting between donors and Ugandan officials on Thursday."",""“Anything less than such actions would breach the trust bestowed on Uganda by the international community,” she said."",""The United States alone, she said, has contributed over $500 million to the UN’s refugee agency, known as UNHCR, and the World Food Program over the last two years."",""Related stories"","""",""The council will be comprised of six civilians and five members of the military."",""The coming elections of 2020 could test Abiy Ahmed’s political staying power.""]",theeastafrican.co.ke/news/ea/Uganda-suspends-officials-suspected-in-relief-scandal/4552908-4297710-format-xhtml-8hcytg
65097,Guinea Bissau’s president sacks govt amid row with PM,"[""GUINEA Bissau’s President Jose Mario Vaz has dismissed the government of the fragile West African nation because of a deepening power struggle with the prime minister."",""Tensions, fed by overlapping duties in Guinea Bissau’s semi-presidential system, have grown between the president and Prime Minister Domingos Simoes Pereira since elections restored civilian rule last year following a 2012 coup."",""In a presidential statement issued late on Wednesday announcing his decision to dismiss Pereira and his cabinet with immediate effect, Vaz referred to what he called “a breach of trust” between the two men."",""There was no immediate reaction from the prime minister, but PAIGC, the ruling party to which both Vaz and Pereira belong, was due to hold a press conference in the capital Bissau yesterday."",""Pereira had previously said PAIGC was planning a convention this year to address the tensions, with a committee expected to study the constitution and clarify the two leaders’ responsibilities."",""Lori-Ann Theroux-Benoni, director of the Institute of Security Studies’ West Africa office, said the row between Vaz and Pereira was just the latest tug-of-war linked to the lack of clarity in the division of power."",""“It’s clearly a power struggle, and unfortunately power struggles in Guinea Bissau have not ended well in the past,” she said.""]",guardian.ng/news/guinea-bissaus-president-sacks-govt-amid-row-with-pm
87920,Police dismiss officer over  alleged killing in Kogi State,"[""Kogi State Police Command has dismissed Sergeant Akpa James from service for allegedly killing one Ohimi Ojima in Ajaokuta Local Council of  the state. Before his dismissal,  James was attached to the Special Protection Unit (SPU), Zone 8, Lokoja.\u0009"",""According to a statement signed by the Kogi State Police Public Relations Officer (PPRO), ASP William Aya yesterday, it was alleged that Ohimi Ojima died during an argument with security men at Ajaokuta Steel Company. He  was ordered to make a U-turn to where he was coming from as that is the only accessible road to Ajaokuta Steel Company Limited (ASCL) but he refused."",""“The victim insisted and went to an extent of attempting to disarm the sergeant and was fatally injured in the process.  He died when he was rushed to ASCL Hospital Ajaokuta for medical treatment, Aya said.”"",""“The sergeant was arrested, detained, tried in orderly room, dismissed from the Force and would be charged to court for prosecution at the end of the proceedings.”"",""The PPRO also debunked media report that the deceased was the younger brother to the governor of Kogi State.He added that, Sergeant James was attached to Special Protection Unit (SPU), Zone 8, Lokoja and not Police Mobile Force (PMF) as reported.""]",guardian.ng/news/police-dismiss-officer-over-alleged-killing-in-kogi-state
335883,Nigeria Ruling Party Expels V.P.,"[""ABUJA, Nigeria (AP) - The ruling party expelled Nigeria's vice president from its ranks Friday and called on President Olusegun Obasanjo to fire him as his deputy after he declared his candidacy in next year's presidential elections.  "",""Vice President Atiku Abubakar fell out with Obasanjo this year amid the president's failed attempt to modify the constitution, which would have allowed him to run for a third term.  "",""Abubakar had been accused of corruption by the ruling People's Democratic Party, or PDP.  "",""The party said Abubakar's intentions to run in the April 27 elections under another banner had cemented the split between them.  "",""\""As far as PDP are concerned, (Abubakar) is no more a member of the party,\"" a party spokesman, John Odey, told reporters in the capital, Abuja.  "",""Odey said party leaders had resolved to demand Obasanjo begin working to strip Abubakar of his duties.  "",""While Abubakar was elected in 1999 alongside Obasanjo in balloting that ended years of brutal military rule, the party said the constitution stipulates that the vice president must be of the ruling party.  "",""The April elections are slated to become the first time an elected government has handed power to another since Nigeria became independent from Britain in 1960.  "",""Nigeria, infamous for its official corruption, is the most populous nation in Africa, and the continent's largest exporter of crude oil.  "",""Abubakar won the support of a small opposition party, the Action Congress, for his presidential candidacy. The ruling party is running a governor from the Muslim north as their candidate.  "",""Katsina Governor Umaru Yar'Adua is considered a formidable candidate, boasting a party structure that was accused of vote rigging during Obasanjo's 2003 reelection. A former military ruler, Muhammadu Buhari, is also in the race.  ""]",ap.com/Nigeria Ruling Party Expels V.P.
95710,Soldiers protest against non-reinstatement after Buhari’s directive,"[""ABOUT 89 soldiers dismissed for allegedly deserting the battle field in Maiduguri, Borno State capital, under the Nigerian Army Operation Zaman Lafiya, embarked on a peaceful protest in Kaduna yesterday, urging the military authorities to reinstate them to join their colleagues in the North East, in continuation of the war against insurgency."",""President Muhammadu Buhari had earlier ordered that all the soldiers dismissed in 2015 for losing ammunition to Boko Haram insurgents in Cameroun should be reinstated, while the Army had in a memo with reference number NA/COAS/GI/7/1 dated July 30, 2015 set up a committee to screen cases of dismissal from the operation."",""The aggrieved soldiers who stormed the premises of the secretariat of Kaduna State Correspondent’s chapel of the Nigeria Union of Journalists (NUJ) yesterday, spoke through their spokesman, Warrant Officer (WO) Shehu Ibrahim, saying that the Army Committee met in Jaji, Kaduna, screened and declared them qualified to be reinstated. But they have not been called back for reasons unknown to them."",""He argued that it was after the clearance that the soldiers were further moved to Kontagora on September 24, 2015 where they went through several weeks of retraining."",""The soldiers said the General Officer Commanding (GOC), 1 Division Nigerian Army, Kaduna, Major General Adeniyi Oyebade, at a point drafted an army officer to investigate their matter, which was done."",""But when journalists contacted the Army Assistant Public Relations Officer, One Division, Colonel Usman Abdul on the issue yesterday, he said: “It is only Army headquarters, Abuja, that can speak on this.”"",""Ibrahim said, “After the re-jabbing, a list of posting was published where the names of 98 of us out of 4,000 soldiers were not included on the list, and we immediately brought the omission of our names to the notice of HQ NATRAC, and our names were compiled and forwarded to the Army Headquarters for inclusion in the posting."",""“Hours later, the same day, nine of the female soldiers on the same 98 men list of omission with serial number 83-91 were singled out, posted to units and given N10,000 each in our presence, whereas we the remaining 89 male soldiers were neglected in Kontagora."",""“We further complained and the HQ NATRAC Commander, Brig. Gen. T.J Dauke told us to write down our particulars and phone numbers and go back to our villages, that we were going to be called upon, with no stipulation to specific date.”""]",guardian.ng/news/soldiers-protest-against-non-reinstatement-after-buharis-directive
230384,Morocco:  King fires ministers for slow progress,"[""Moroccos king has dismissed several ministers and top officials for failing to improve the economic situation in a region amid protests."",""Moroccos King Mohammed IV dismissed the ministers of education, planning and housing and health, as well as other officials, after an economic agency found imbalances in implementing a development plan, state news agency MAP reported, citing a palace statement."",""According to an official investigation committee set up by the king in June a large-scale development program in Al Hoceima launched in 2015 were lingering due to delays."",""Protests erupted in the Rif region around the northern city of Al-Hoceima last October, triggered by the death of a fishmonger whose produce was confiscated by police."",""The mans crushing to death in a garbage truck during a confrontation with police became a symbol of corruption and official abuse."",""Protests, also fuelled by economic underdevelopment, continued in Morocco in 2017."",""Political protests are rare in Morocco, where the palace remains the ultimate power."",""The protests, the largest in Morocco since the days of the 2011 Arab Spring, were directed at the government and the kings entourage rather than the monarch himself."",""The kings move came as protest leader Nasser Zefzafi and 29 others accused of organizing demonstrations in the northern region went on trial in Casablanca."",""They face charges ranging from conspiring against the state to protesting without authorization. Zefzakis lawyer told Reuters he could be sentenced to death in a worst-case scenario."",""The judge adjourned the session until Oct 31. Zefzakis supporters protested in front of the court while some 70 lawyers attended the trial."",""The protest movement was born after Fikris death."",""Police confiscated fish they said he had bought illegally and dumped it in a garbage truck. Desperate to recover his stock, Fikri jumped inside and was killed by a rubbish crusher."",""In July the king pardoned dozens of people arrested in the protests and blamed the failure of local officials to quickly implement development projects for stoking public anger."",""Culled""]",nan.ng/news/morocco-king-fires-ministers-slow-progress
309565,"Breaking: Plateau governor, ‘Lalong’ sacks SSG, appoints Chief of Staff","[""Governor, Simon Lalong of Plateau state, Thursday sacked the Acting Secretary to the State Government, Mr Richard Tokma."",""He replaced him with Prof. Danladi Abok Atu."",""A statement by the Director of Press and Public Affairs, Mr Makut Macham has it that Lalong equally appointed Noel K. Donjur as his Chief of Staff."",""FG ‘ll no longer tolerate bullying in secondary schools, says Minister(Opens in a new browser tab)"",""Read the statement below:"",""“Plateau State Governor Rt.Hon. Simon Bako Lalong has announced the appointment of Prof. Danladi Abok Atu as the Secretary to the Government of Plateau State. Prof. Atu until now is the Director, Institute for Peace and Social Rehabilitation, University of Abuja."",""“Similarly, the Governor has appointed Noel K. Donjur as his Chief of Staff. Until his appointment, Mr. Donjur was a former Commissioner for Works and Current Member of the Plateau State Economic Council”"",""Vanguard""]",vanguardngr.com/2019/08/breaking-plateau-governor-lalong-sacks-ssg-appoints-chief-of-staff
26757,Somali president names new premier,"[""The president needs parliament's approval to sack the prime minister, according to Somali transitional government's federal charter."",""'Desperate measure'"",""Hussein, who became Somalia's prime minister in November 2007, has in the past few months been in dispute with Yusuf over efforts towards a peace deal with the Alliance for the Re-liberation of Somalia (ARS), the country's main opposition group."","""",""“I have heard about the president’s appointment of a new prime minister. The president has repeatedly violated Somalia’s charter and the interim government’s charter, and this is not new,\"" Hussein told Al Jazeera."",""“I reject the appointment of a new prime minister as the president does not have the power to dismiss the prime minister; only the parliament can dismiss or withdraw confidence in the prime minister."",""\""The president can not be above the law or above the constitution, and he can not do whatever he wants.\"""",""Mustafa Duhullow, Somalia's agriculture minister, dismissed Yusuf's decision as a \""personal wish that will not have legal effect.\"""",""\""Hussein is the legitimate prime minister of Somalia approved by the parliament, but the president has the right to nominate whoever he wants,\"" Duhullow told the news agency AFP."",""\""This is a desperate measure by the president to interrupt the ongoing peace talks between the TFG [Transitional Federal Government] and the opposition,\"" he said."",""Aden Mohamed Nur, the parliamentary speaker, said the vote results on Monday showed that 143 members of parliament had \""recognised the existence of the government, 20 rejected it and seven abstained\""."",""Kenya imposed sanctions on the Somali president and his family on Tuesday."",""Moses Wetangula, Kenya's foreign affairs minister, said Yusuf was an obstacle to peace. The sanctions include a travel ban and freezing any assets in Kenya."",""Somalia has been without an effective government since the overthrow of Mohamed Siad Barre, the former president, in January 1991.""]",aljazeera.com/news/africa/2008/12/2008121673914660145
393207,Omtatah wants court to block nomination of Solicitor General,"[""Activist Okiya Omtatah on Friday moved to court seeking to suspend the nomination of Kennedy Ogeto as the Solicitor General."",""The activist once again listed President Uhuru Kenyatta as a respondent in the case despite the Office of the Attorney General moving to court on Wednesday seeking to have the presidents name struck out in another case by the activist claiming the Head of State cannot be sued."",""In his affidavit, Mr. Omtatah says that the president violated the Constitution by creating the position of Chief Administrative Secretary (CAS) without public participation."",""Article 10(2)(a) categorically provides that the national values and principles of governance include the rule of law, democracy and participation of the people, reads the petition."",""He claims that the president handpicked Mr. Ogeto as Solicitor Generalwithout him being first identified and recommended by the Public Service Commission (PSC) through a competitive and merit based recruitment."",""Omtatah wants the court to restrain President Kenyatta, PSC, The Office of the Attorney General and the Speaker of National Assembly Justin Muturi from effecting the nomination of Mr. Ogeto."",""He is further seeking orders to stop Speaker Muturi from receiving Mr. Ogetos name for vetting."",""The activist also argues that that the president is bound by the Constitution and other laws of Kenya and has no capacity to act beyond or outside the law."",""It is of utmost importance that the impugned decision of President Uhuru Kenyatta is suspended to protect constitutionalism and the rule of law, the interest of the public and to protect these proceedings for being rendered nugatory , says Omtatah in his affidavit."",""He further says that the court has a duty and the jurisdiction to stop what he terms asblatant disregard of the rule of law."",""Unless this case is heard urgently and determined, Kenyans will suffer great loss as the Constitution and the rule of law will continue to be violated and threatened,says Omtatah."",""On Tuesday this week, President Kenyatta made two more changes in governmentby nominating Mr. Ogeto as Solicitor General and moving Njee Muturi to the position of Deputy Chief of Staff."",""He also nominated Court Of Appeal President Kihara Kariuki as Attorney General following the resignation of Githu Muigai.""]",citizentv.co.ke/news/omtatah-wants-court-to-block-nomination-of-solicitor-general-191098
93711,Serbian PM sacks defence minister over sexist comments,"[""Serbia’s premier on Monday fired his defence minister after he made an “insulting” remark to a female journalist that sparked outrage from the opposition and gender equality groups."",""The minister, Bratislav Gasic, caused public uproar by making a sexist aside to a women reporter from B92 private television who knelt down to avoid getting in shot while he was making a statement."",""“I like these female journalists who kneel down so easily,” Gasic said."",""Prime Minister Aleksandar Vucic fired Gasic, saying there was “no excuse” for his comment. "",""“We need to protect women in Serbia. This was an offence for all women in Serbia,” said Vucic, adding that the minister would be formally replaced in the coming days."",""Media groups, opposition parties and gender equality organisations all leaped to condemn the remark."",""“Such a statement is inadmissible and insulting not only for female journalists but for all women,” said Brankica Jankovic, commissioner for protection of equality."",""Gasic issued a public apology later on Sunday, expressing “sincere regrets” for his “shameful and scandalous behaviour.”"",""Gasic, 48, was mayor of the central town of Krusevac before taking office as the defence minister in April 2014."",""He is one of Vucic’s closest allies and vice-president of the ruling Serbian People’s Party (SNS). ""]",guardian.ng/news/serbian-pm-sacks-defence-minister-over-sexist-comments
34036,Senegal's president replaces prime minister,"[""Senegal's President Macky Sall has fired Prime Minister Abdoul Mbaye, replacing him with Justice Minister Aminata Toure."",""\""The president has asked me to form and lead a new government...I have accepted the job,\"" Toure said."",""Presidential spokesman Abou Abel Thiam did not disclose the reason of announcing Mbaye’s departure on Sunday."",""Mbaye, who was not a member of any political party, had been chosen for the post right after Sall's March 2012 election victory."",""Mbaye studied in Senegal and France's top business schools and previously worked at West Africa's BCEAO central bank."",""He has been credited with turning around several ailing private banks in the country."",""Sall won a hotly contested presidential election in 2012 against veteran incumbent Abdoulaye Wade, promising to tackle poverty and corruption as a priority and reduce the cost of running the West African state's government.""]",aljazeera.com/news/africa/2013/09/201391154811577689
