Column1,title,text,url
327962,Somalia’s President Fires Prime Minister but May Not Have the Power to Do So,"[""NAIROBI, Kenya — The president of Somalia announced Sunday that he was unilaterally firing the prime minister, throwing Somalia’s beleaguered government, and the nation itself, into further disarray."",""President Abdullahi Yusuf Ahmed, a warlord in his 70s who has been steadily marginalized for several months because he is widely seen as an obstacle to peace, said he was dismissing Prime Minister Nur Hassan Hussein, a former aid official, because the government had “failed to accomplish its duties.”"",""But it is not even clear that the president has the authority to do this."",""According to the transitional government’s charter, only Parliament can hire or fire the prime minister. And most analysts believe Parliament — a fractious, unpredictable group that is dominated by former warlords — actually supports the prime minister, which means a high-level showdown may be coming next."",""Mr. Nur said he was not going anywhere."",""On Sunday, he insisted the president had no right to fire him and that only “Parliament has the authority to sack the government.”"",""The two men have never really gotten along, constantly blaming each other for the ever-deepening crisis that Somalia has sunk into, from the current piracy problem to the Islamist resurgence to the looming famine that is threatening millions of lives."",""The latest bone of contention is a peace agreement that Mr. Nur helped broker between the government and a group of moderate Islamist opposition leaders. Mr. Yusuf rejected that agreement and called the Islamists terrorists."",""Many Western diplomats are supporting Mr. Nur and have indicated in recent weeks that they are fed up with Mr. Yusuf."",""But the bickering and posturing within the transitional government may, in the end, be purely academic. The transitional government now controls no more than a few city blocks in a country almost as big as Texas. The Ethiopian troops who have been shoring it up for the past two years have said they were about to withdraw, and a small force of African Union peacekeepers in Somalia is expected to follow."",""Most analysts say that as soon as the Ethiopians pull out, the Islamist insurgents who have seized control of most of the country in the past year will take over the capital, Mogadishu. The transitional government will then collapse, as did the 13 transitional governments before it, the analysts predict."",""The Somali Parliament is expected to meet in the coming days. On top of the president’s move to dismiss Mr. Nur, members of Parliament are also considering a measure to impeach President Yusuf."",""One serious risk, though, is that Mr. Yusuf still enjoys the support of his clan, one of the biggest in the country. Many analysts worry that too drastic a move against him could ignite the type of heavy clan warfare that brought down Somalia’s central government in 1991 and has kept the country mired in violent chaos ever since.""]",nytimes.com/2008/12/15/world/africa/15somalia
382317,Greece suspends police officer for swearing at woman,"[""The Greek police has suspended an officer and ordered an internal inquiry after a video showed him verbally abusing an elderly woman at a migrant camp, police said on Saturday, amid growing violence toward migrants in Greece."",""The woman was standing in a long line waiting for food handout at Greeces biggest migrant camp in Moria on the Aegean island of Lesbos, when the police officer insulted her using offensive language."",""The police said it would carry out an internal inquiry into the incident for racism and will also examine whether three other police officers shown in the video should also be suspended."",""The three officers were standing nearby but took no action."",""Attacks on migrants have been creeping up in Greece which is struggling to cope with thousands of people stranded in overcrowded camps since a migrant crisis broke out in 2015."",""The Moria camp has long been described by the United Nations and other human rights organizations as overcrowded and unfit for humans. More than 7,300 refugees and migrants are currently in the former military camp in a collection of shipping containers and flimsy tents, more than double its 3,100-person capacity, according to the latest government figures."",""To ease overcrowding, authorities have begun moving hundreds to facilities on the mainland.""]",citizentv.co.ke/news/greece-suspends-police-officer-swearing-woman-215800
121946,Police Command dismisses 5 men in 6 months,"[""The Lagos State Police Command on Sunday announced it had dismissed five out of 92 policemen tried for various offences in the first half of the year."",""According to a statement by the Command’s spokesman, SP Child Oti, three of the five dismissed policemen were tried in connection with the Ojota incident where policemen reportedly tear-gassed a man."",""“The Commissioner of Police, CP Imohimi Edgal, has dismissed the three police men, comprising an inspector and two sergeants, who were alleged to have sprayed tear-gas on Mr Ademuwagun Temitope Solomon which provoked severe asthmatic crisis in him."",""“The incident took place at Chinese town, Ojota area of Lagos State."",""Theeir names and service numbers were given as 220957 Inspector Momoh Sulaiman; 429659 Sgt. Emmanuel Monday and 434246 Sgt. Adamu Usman."",""The statement said they were tried in an orderly room which commenced on Saturday and were found guilty as charged."",""“They were, therefore, dismissed and de-kitted accordingly. However, the dismissal proceeding of Inspector Momoh Sulaiman has been forwarded to the Assistant Inspector General of Police, Zone Two for approval."",""“Similarly, the command wishes to use this medium to release its half year disciplinary record for the period spanning from January to June, 2018."",""“The officers were tried in a properly constituted orderly room and were found guilty of various offences against discipline which earned them appropriate punishments, depending on the charges against them."",""“The breakdown of types of punishment awarded to deserving officers are: Dismissal-5, Reduction in Rank-4, Major Entry-43, Severe Reprimand-3, Extra Fatigue-4, Warning Notice-28, Discharged and Acquitted-5, Total 92."",""“The Commissioner of Police said that this would serve as a deterrent to other police men wishing to toe the path of infamy; that the Nigeria Police under the watch of the Inspector General of Police, have no room for them."",""“He warned all serving police officers to be professional at all times in the discharge of their duties and shun corrupt practices.” the statement advised.""]",guardian.ng/news/police-command-dismisses-5-men-in-6-months
358641,Nigeria denies judge's suspension influenced by election,"[""ABUJA, Nigeria (AP) — Amid growing criticism, Nigeria's information minister denied on Monday that the president's recent suspension of the country's chief justice was related to the upcoming presidential elections."",""The suspension of Chief Justice Walter Nkanu Samuel Onnoghen had \""nothing to do with the forthcoming elections\"" and did not \""signify the onset of dictatorship or tyranny as some have insinuated,\"" Minister Lai Mohammed said."",""The chief justice faces trial on charges of allegedly failing to declare his assets, which Onnoghen has argued is without merit. This is the first time a chief justice is standing trial in Nigeria, Africa's most populous country with 190 million people."",""Critics say the suspension of the chief justice just three weeks before the election is an effort by President Muhammadu Buhari to weaken Nigeria's judiciary and pave the way for his election to a second term in the Feb. 16 vote."",""The chief justice plays a key role in any legal challenge to what could be a disputed vote."",""The Nigerian Bar Association called the suspension an \""attempted coup against the Nigerian judiciary\"" this weekend and the president's rival called the suspension \""an act of dictatorship\"" meant to influence the election."",""The U.S., Britain and the European Union said Saturday that Buhari acted \""without the support of the legislative branch.\"" The U.S. warned this suspension could \""cast a pall\"" over the Feb. 16 vote, in which Buhari seeks a second term."",""Buhari said the chief justice's suspension will continue until the case is concluded and has appointed an acting chief justice, Ibrahim Tanko Muhammed. Muhammed is from Nigeria's largely Muslim north, like Buhari, while Onnoghen is from the largely Christian south."",""The information minister dismissed the uproar as \""theater of the absurd,\"" accusing the opposition of \""muddying the waters\"" and acting in \""hysteria.\"""",""Presidential spokesman, Garba Shehu, said Monday the president broke no laws in the suspension and \""has done no wrong.\"""",""With tensions ahead of the vote, observers warned against election-related violence."",""Oil-rich Nigeria struggles against multiple security challenges, including the decade-old Boko Haram extremist insurgency, and Buhari's 2015 election was a rare peaceful transfer of power. Diplomats have urged the top candidates to sign a peace pledge."",""___"",""AP reporter Sam Olukoya in Lagos contributed to this report.""]",ap.com/Nigeria denies judge's suspension influenced by election
72992,Leadership crisis hits Nigerian community in Ghana,"[""The All Nigerian Community in Ghana has suspended its President, Mr Moses Owharo, for alleged manipulation of the bank account of the association."",""A statement by the Public Relations Officer, Mr Barry Ndu, made available to newsmen in Owerri on Thursday said that the suspension was to allow full investigations into the matter."",""According to Ndu, the suspension is the decision of congress of ANC which held at its secretariat on Sept. 28 ratified by the board of trustee, members and delegates from other regions of Ghana."",""Ndu added that already the matter had been reported to Ghana Police, saying the members want the investigation to follow due process of the law so as to unravel circumstance that led to tampering of ANC United Bank of Africa account."",""Ndu stated that ANC account was frozen since 2013 due to court action against the body, but it was recently uncovered that fake resolution purported to have come from the executive council of the association was used to make withdrawal from the account."",""It was further revealed that two of the said new signatories were Daniel Obiora and Godwin Onowu, who were neither members of the congress nor executives of the association."",""“The congress perceived the action as gross violation of all known rules binding members of ANC."",""“For the sake of transparency, due process and in line with the anti-corruption agenda of Nigeria government which all Nigerians must be part of as ambassadors of the country, the executives have decided to immediately suspend Owharo as its president,’’ he said."",""He noted that Owharo had equally been summoned by the body to explain his role in the change of signatories and withdrawals made from the ANC Ghana UBA Account."",""But in a swift reaction Owharo told NAN that the allegation was false."",""Owharo told NAN in a telephone interview that there was no leadership crisis in ANC in Ghana."",""“As I speak with you, I am still the president of ANC, Ghana, and the Nigeria High Commission in Ghana still work with me and so those carrying fake report that I am no longer the president are merely spreading falsehood,’’ Owharo said.""]",guardian.ng/news/leadership-crisis-hits-nigerian-community-in-ghana
388006,Magufuli fires intelligence chief Kipilimba ahead of elections,"[""Tanzanian President John Pombe Magufuli has sacked the countrys intelligence chief Modestus Kipilimba just one year before the general elections."",""Dr. Kipilimba had only served for three years out of the five years of his term."",""According to Reuters, the latest move is seen as indicating a shake-up of the intelligence network ahead of elections next year."",""The Citizen, a Tanzanian newspaper, said his tenure is one of the shortest since Tanzanias independence in 1961."",""The press statement announcing his sacking was signed by the head of presidential communications, Gerson Msigwa."",""It said he will be assigned other duties but with no specifics on what the new responsibilities would be."",""Prior to his appointment, he had served as the director of the National Electoral Commission (NEC) voters register."",""He was appointed to head intelligence in 2016 just a few months after President Magufuli was sworn in as the president of Tanzania."",""According to the Guardian, Diwani Athumani has been sworn in to serve as the new intelligence chief."",""Up until his appointment Commissioner Athumani headed the Prevention and Combating of Corruption Bureau (PCCB).""]",citizentv.co.ke/news/magufuli-fires-intelligence-chief-ahead-of-elections-276331
131993,Nigeria's acting president asserts power by sacking cabinet,"[""Nigeria's acting president, Goodluck Jonathan, last night sacked all cabinet ministers in an attempt to stamp his authority on Africa's most populous country."",""Jonathan dissolved the cabinet without explanation in his first major act since assuming executive powers just over a month ago. It effectively left the quiet 52-year-old biologist in sole command of government."",""The cabinet had consisted mainly of ministers loyal to the ailing president, Umaru Yar'Adua, a Muslim from the country's north, although some members had begun to shift allegiance to Jonathan, a Christian from the south."",""Dora Akunyili, the outgoing information minister, said: \""The acting president gives no reason for the dissolution. There is no vacuum in the government as permanent secretaries will take charge.\"""",""She said Jonathan would issue a statement soon on who will serve in the new cabinet governing the oil-rich nation of 140 million people."",""Akunyili herself had previously circulated a memo to the cabinet calling on it to install Jonathan as acting president, providing a rare public voice for those uncomfortable with Yar'Adua's long absence from the country."",""Yar'Adua, who has a history of ill-health, has not been seen in public since November. He was treated at a hospital in Saudi Arabia for a heart condition for three months and only recently returned to Nigeria."",""The national assembly empowered Jonathan to become acting president in a vote on 9 February. Two weeks later, Yar'Adua's handlers apparently whisked the president back to the presidential palace in an ambulance surrounded by a military convoy."",""Jonathan has largely shied away from making major decisions since becoming acting president, though he did move some cabinet ministers loyal to Yar'Adua into new positions. Fears of a coup permeated the country, which has a long history of military dictators, but top officers promised not to intervene."",""The armed forces will probably be kept at bay, even with Jonathan asserting more power, said Charles Dokubo, an analyst with the Nigerian Institute of International Affairs. Yar'Adua supporters \""might make noise about it, but I don't think it will lead to any other upheaval or anarchy in the country,\"" he told the Associated Press."",""The powerful governors of Nigeria's 36 states, senior ruling party officials and other lobby groups will now put forward nominees for new ministers. Jonathan will thendraw up a shortlist to be screened and approved by the senate."",""Jonathan's public statements have shown a will to accelerate, not depart from, Yar'Adua's policies. His priorities include electoral reform, fighting corruption, delivering reliable electricity supplies and reviving an amnesty in the Niger Delta.Yar'Adua was dubbed \""Baba Go-Slow\"" because of slow progress by his administration on key issues, and Jonathan's latest move could allow him to speed up some government business before elections next year."",""Antony Goldman, the head of London-based PM Consulting, said: \""The old government was divided and demoralised … The challenge for Jonathan is to produce an administration that isn't divided, given the very short tenure that remains."",""\""In the meantime, Nigeria may be one of those places where the absence of ministers will actually facilitate rather than hold up government.\"""",""Jonathan's efforts to assert his authority come as Nigeria tries to contain violence in the \""Middle Belt\"" between its mostly Muslim north and largely Christian south, which has killed hundreds of people this year. At least 10 people died in an attack on a mainly Christian village near Jos yesterday.""]",theguardian.com/world/2010/mar/17/nigeria-acting-president-sacks-cabinet
94948,South Africa’s Zuma reels after U-turn on finance minister,"[""South Africa’s President Jacob Zuma faced a barrage of criticism Monday after sacking two finance ministers within five days in a political drama that raised questions over the future of his leadership."",""Zuma last week ousted respected finance minister Nhlanhla Nene in favour of the little-known David van Rooyen, triggering a backlash that forced him into a U-turn on Sunday when Rooyen himself was removed."",""The tumult triggered a collapse in the rand as investors pulled out of the country, which is beset by high unemployment, slow growth and accusations of worsening government corruption."",""Zuma has led the African National Congress (ANC) since 2007, but the debacle over the key role of finance minister pointed to a major power shift within the party that has ruled since the end of apartheid in 1994."",""“This represents a very dark day for Zuma, who has clearly been shown the limits of his authority,” leading commentator Ray Hartley wrote in the Rand Daily Mail."",""“For someone who projects himself as a political ‘strongman’, this represents a devastating moment. It shows that he simply does not have the power that he believed he had accrued in the party.”"",""Pravin Gordhan, who served as finance minister from 2009 to 2014, was re-appointed to the role late on Sunday to try to calm markets after the rand fell to an all-time low of 16 to the dollar when Nene was fired."",""Monday, the local currency had recovered some ground, to  15.11 to the dollar."",""Gordhan, 66, was due to give a press conference in Pretoria at 1:00 pm (1100 GMT) on Monday."",""“Zuma panics” read the headline on the Sowetan newspaper after the shock return of Gordhan."",""“It’s very tumultuous time for South Africa and it’s reflective of the crisis of leadership,” Nicky Weimar, senior economist at Nedbank, told AFP."",""“While you had Nene in charge, the foreign investors could say that South Africa had a transparent and predictable (economic) policy, but this sparks a tremendous amount of questions about political interference.”"",""– ‘Very damaging’ –"",""Zuma issued a statement on Sunday saying that he was removing Van Rooyen after only four days in response to “many representations”."",""The ANC issued an official statement welcoming Gordhan’s appointment as “an explicit demonstration of a responsive and accountable government”."",""Zuma was accused of sacking Nene partly because the minister had publicly slapped down a move by state-owned South African Airways (SAA) to renegotiate a plane-leasing deal with Airbus."",""The president, who has four wives, on Saturday took the unusual step of officially denying rumours that he had a romantic relationship with SAA board chairwoman, Dudu Myeni."",""Nomura analyst Peter Montalto said that it was opposition within the ANCto Van Rooyen’s appointment that pushed Zuma into his surprise U-turn."",""“The fact that the ANC is a broad church has actually forced Zuma to reverse his decision in a very damaging move for him personally,” Montalto said."",""Judith February, senior research associate at the Institute of Security Studies in Pretoria, suggested Zuma’s leadership could be under threat from within the ANC."",""“This is the lowest point of his presidency,” she said."",""“He has lost whatever credibility that he might have left. But we must remember that Zuma is a fighter.”"",""The ANC, which easily won the 2014 general election, faces local elections next year when it may struggle to retain control of municipalities including Johannesburg, the economic capital.""]",guardian.ng/news/south-africas-zuma-reels-after-u-turn-on-finance-minister
84035,"Okorocha sacks information commissioner, others","[""Imo State Governor Rochas Okorocha has sacked the Commissioner for Information, Tourism and Public Utilities, Dr. Vitalis Orikeze Ajumbe and some other officials in his cabinet."",""A statement by his Principal Secretary, Dr. Paschal Obi, directed the sacked commissioner to hand-over all government property in his possession to the permanent secretary of the ministry."",""Ajumbe was sworn in 2015 as the interim management chairman of Imo Broadcasting Corporation (IBC) and later appointed the Commissioner for Internal Resources and Pensions Matters before his last appointment."",""Okorocha also sacked his Special Adviser on Public Enlightenment, Dr. Kelechi Okpaleke and appointed the Transition Committee Chairman of Ikeduru Local Council, Obinna Nshirim to replace him."",""The Special Assistant to the Governor on Niger Delta Affairs, Justice Ojika was also relieved of his appointment."",""The governor has announced Pastor Ralph Afoaku as the new director general of the IBC."",""Afoaku, until his recent appointment was the Personal Assistant to Okorocha on Media Productions."",""According to the statement, Chief Val Mbamala is now the Special Adviser on Public Enlightenment, while Anoayo Chukwu Obasi Odo Idiong is the Principal Officer to the Governor on Electronic Media."",""Mr. Evan Enwerem (Junior) is the Transition Committee Chairman nominee for Ikeduru Local Council."",""All the appointments, the statement says, are with immediate effect.""]",guardian.ng/news/okorocha-sacks-information-commissioner-others
467856,"South Sudan military chief, Finance minister fired","[""South Sudan’s President Salva Kiir has dismissed army commander Marial Chanuong Yol and Finance minister Stephen Dhieu Dau."",""The state-owned television announced the sackings on Monday evening, without giving reasons for President Kiir's decision."",""Gen Yol, nicknamed Tiger, was the commander of the presidential guard, before he was appointed the army chief of operations, training and intelligence last year."",""He was blacklisted by the UN Security Council in 2015 for alleged war crimes and crimes against humanity committed during the onset of war in December 2013 against members of the the Nuer ethnic group."",""Mr Dau was appointed Finance minister in 2016, with the hope of improving South Sudan's straining economy. However, the economy of the young nation has never been stable, especially since the 2015 devaluation of the South Sudanese Pound (SSP)."",""Former technical advisor at the Ministry of Trade Salvatore Garang Mabiordit, was named the new Finance minister."",""South Sudan attained independence in 2011 following a referendum whose outcome favoured the separation from Sudan with a 98 per cent approval."",""However, it soon descended into another round of conflict pitting President Kiir's loyalists and those allied to his former deputy Riek Machar."",""The current phase of the South Sudan war has claimed more than 100,000 lives, according to the International Crisis Group."",""Over 2 million South Sudanese have become refugees in neighbouring countries and another 1.9 million others remain internally displaced, according to the UN."",""The war has also caused one of the world’s worst humanitarian crises after the Rwanda 1994 genocide, the UN added."",""Multiple human rights abuses have also been documented by various groups."",""Treasury seeks additional funding of $866m, increasing the 2019/2020 budget to $30.4bn."",""Exporting nations cited for exceeding allowable levels of chemicals in fresh farm produce.""]",theeastafrican.co.ke/news/ea/South-Sudan-military-chief-Finance-minister-sacked/4552908-4339592-xdc6ia
387978,Magufuli fires intelligence chief Kipilimba ahead of elections,"[""Tanzanian President John Pombe Magufuli has sacked the countrys intelligence chief Modestus Kipilimba just one year before the general elections."",""Dr. Kipilimba had only served for three years out of the five years of his term."",""According to Reuters, the latest move is seen as indicating a shake-up of the intelligence network ahead of elections next year."",""The Citizen, a Tanzanian newspaper, said his tenure is one of the shortest since Tanzanias independence in 1961."",""The press statement announcing his sacking was signed by the head of presidential communications, Gerson Msigwa."",""It said he will be assigned other duties but with no specifics on what the new responsibilities would be."",""Prior to his appointment, he had served as the director of the National Electoral Commission (NEC) voters register."",""He was appointed to head intelligence in 2016 just a few months after President Magufuli was sworn in as the president of Tanzania."",""According to the Guardian, Diwani Athumani has been sworn in to serve as the new intelligence chief."",""Up until his appointment Commissioner Athumani headed the Prevention and Combating of Corruption Bureau (PCCB).""]",citizentv.co.ke/news/magufuli-fires-intelligence-chief-ahead-of-elections-276331/indexamp
