Column1,title,text,url,date,location
358205,Attack in north Mali kills 3 peacekeepers,"[""TIMBUKTU, Mali (AP) — Three U.N. peacekeepers were killed and five others wounded in Mail during an attack on a convoy, the United Nations mission in the African nation said."",""A U.N. official said the convoy hit a land mine around 7 a.m. about 45 kilometers (28 miles) from the northern Gao region. The official spoke on condition of anonymity because he wasn't permitted to speak to the media on the matter."",""U.N. Secretary-General Antonio Guterres issued a statement condemning the attack. He also the dead were peacekeepers from Bangladesh and send his condolences to their families."",""No group had yet to claim responsibility for the attack, but it resembled other attacks linked to al-Qaida in the region."",""The peacekeeping mission in Mali is the deadliest of the U.N.'s 16 global peacekeeping operations. Two peacekeepers were killed earlier this month in Kidal.""]",ap.com/Attack in north Mali kills 3 peacekeepers,23-09-17 20:00,
315963,Egyptian police kill terrorist group in North Sinai,"[""Egyptian police forces killed a terrorist group during a shootout in the country’s restive North Sinai Province, Egyptian Ministry of Interior announced Sunday."",""Three officers and one policeman were also injured in the exchange of fire, the ministry said in a statement."",""Police confirm 3 killed in Akwa Ibom cult clash(Opens in a new browser tab)"",""According to the statement, the national security sector obtained information that terrorist elements were present in the Gilbane area of North Sinai and were preparing and planning a series of attacks against the armed forces and police."",""The ministry said police forces spotted the terrorists inside a pickup truck, adding that the terrorists fired heavily at the police once they realised they were tightly cordoned."",""The exchange of fire resulted in the death of all the terrorists, the ministry said, revealing that a number of automatic guns and tools used in the manufacture of bombs were found in the truck."",""The truck was reported to be stolen on Sept. 9 from a citizen while travelling in Gilbana, according to the statement."",""Also in Gilbana, a member of the same group was killed during a shootout when the police besieged his hideout, the statement added."",""The police said the national security spotted his hiding place, according to trusted information."",""Education ministry partners ICPC, EFCC to curb exam malpractice(Opens in a new browser tab)"",""Terrorism has been plaguing Egypt since the 2013 ouster by the military of former President Mohamed Morsi, who died in court in June, in response to mass protests against his government and his Muslim Brotherhood group."",""Terror attacks, killing hundreds of policemen and soldiers in the restive North Sinai province, have gradually spread to other provinces in recent years."",""Most of these attacks were claimed by a Sinai-based group affiliated with the regional Islamic State militant group. (Xinhua/NAN)"",""Vanguard""]",vanguardngr.com/2019/09/egyptian-police-kill-terrorist-group-in-north-sinai,14-09-19 20:00,Nigeria
360422,"Niger, Chad forces kill 126 extremists since July, army says","[""NIAMEY, Niger (AP) — Niger's army says joint operations with Chad's military have killed about 126 Islamic extremists since July."",""Niger army spokesman Michel Ledru Moustapha said Monday that forces from Niger, Chad and Nigeria have re-occupied several cities in northern Nigeria after Boko Haram extremists killed more than two dozen soldiers in Niger's town of Bosso in June. Bosso borders Nigeria, where Boko Haram originates."",""Moustapha also says joint forces have captured two of the Boko Haram extremists."",""Niger contributes to the multi-national force set up to fight Boko Haram in the region. The group's seven-year insurgency has killed at least 20,000 people and displaced 2.6 million, according to Amnesty International and the United Nations."",""\nBoko Haram militants pledged support to the Islamic State last year.""]","ap.com/Niger, Chad forces kill 126 extremists since July, army says",02-10-16 20:00,
458104,Somalia: US Baledogle training base attacked,"[""A military base where US soldiers train commandos in Somalia was attacked Monday, causing casualties, reports say."",""Local residents reported heavy blasts and gunfire at Baledogle airport in the southern Lower Shabelle region."",""The al-Shabaab militant group claimed responsibility for the attack."",""Military officials say the Shabaab have been pushed back."",""The base, about 100 kilometres (60 miles) west of the capital Mogadishu, is said to house US special forces, Somali special forces and Ugandan peacekeepers. It is used as a launch site for US drones as well as a training centre."",""Separately, an Italian military convoy was hit by an explosion in Mogadishu itself, Italy's defence ministry said. No casualties have as yet been reported."",""The US has sharply increased its air strikes against al-Shabaab, which is linked to al-Qaeda, since President Donald Trump took power."",""Officials in Somalia say the group has increased its attacks in Mogadishu as retaliation for the air strikes."",""Treasury seeks additional funding of $866m, increasing the 2019/2020 budget to $30.4bn."",""Exporting nations cited for exceeding allowable levels of chemicals in fresh farm produce.""]",theeastafrican.co.ke/news/ea/attack-US-training-base-Somalia/4552908-5293024-format-xhtml-npyoytz,29-09-19 20:00,Somalia
353547,Somali extremists kill 15 government soldiers in ambush,"[""NAIROBI, Kenya (AP) — At least 15 government soldiers were killed in an ambush by fighters from the Somali Islamic extremist rebel group al-Shabab, one day after the same group of extremists killed a dozen people in an attack in the capital, a military official said Monday."",""The ambush happened late Monday near Walaweyn, a town in the Lower Shabelle region, about 93 kilometers (57.79 miles)south of Mogadishu, said Col. Ahmed Muse of the Somali military."",""The rebels seized three military vehicles during the attack, he told The Associated Press by phone from Walaeyn."",""Al-Shabab claimed responsibility for the attack, according to the group's online radio known as Andalus, saying 30 soldiers had been killed. It wasn't possible to independently verify the group's claims."",""On Sunday, Islamic extremists attacked a hotel in Mogadishu, killing at least 12 people and injuring many others before all the assailants were killed by security forces."",""The Sahafi Hotel is often frequented by Somali government officials and business executives, and had been targeted before. Two French security advisers were abducted from the hotel by militants in 2009."",""Despite being forced out of Mogadishu and many other cities and towns across Somalia, al-Shabab continues to launch lethal attacks in the capital and elsewhere. Al-Shabab is fighting to oust the Mogadishu government and install a strict version of Shariah law."",""Al-Shabab has also attacked neighboring countries that have sent troops to support the Mogadishu government. The extremist rebels killed 148 people in an attack on a college in Garissa, Kenya, in April.""]",ap.com/Somali extremists kill 15 government soldiers in ambush,01-11-15 19:00,
315966,Five Congolese refugees shot dead in Rwanda,"[""At least five Congolese refugees were shot dead and 20 others were injured on Thursday in western Rwanda, the police has said."",""About 2,000 refugees from Kiziba settlement in Karongi district had marched out of the camp to protest against reduced food rations by the UN agency, World Food Programme (WFP), on Tuesday."",""Despite a scuffle with Rwandan soldiers where some of the refugees are said to have been shot at and wounded, they walked to the UN refugee agency, UNHCR, offices some 15km from their Kiziba camp where they have been camping."",""On Thursday, police tried to disperse them using teargas, a situation which quickly turned chaotic."",""Confirming the incident, Rwanda National Police (RNP) spokesperson Theos Badege accused the refugees of pelting officers with stones and sharp objects."",""The police said that the officials from the Ministry of Disaster Management and Refugees Affairs, the UNHCR, and local leaders urged the protesters to return to their camp as their grievances were being looked into."",""“However, these calls were met with strong resistance that turned violent. Refugees armed with sharp objects (stones, sticks and metal pieces) began to assault police officers, who then used teargas to disperse the unacceptable riots and secure the nearby community,” RNP said."",""“When the attacks persisted, we used proportional force that left 20 rioters and 7 police officers injured. They were rushed to hospital, 5 rioters unfortunately succumbed to their wounds and 15 arrested for illegal demonstration, taking hostage and inciting violence,” the police said on its Twitter account."",""One of the refugees, who identified himself as Fiston Munyaburanga, told The EastAfrican that they would continue to fight for their rights or be facilitated to return home."",""“We are hungry. We cannot continue to die of hunger inside the camps. We would rather go home,” Mr Mumyaburanga said."",""The Kiziba camp hosts 17,000 Congolese refugees."",""Rwanda houses more than 173,000 refugees from Democratic Republic of Congo and Burundi in six camps in the country of whom over 100,000 are Congolese."",""Following the Tuesday protests, UNHCR Wednesday urged Rwandan authorities to exercise restraint while also cautioning refugees against making uninformed decisions on repatriation \""out of desperation\""."",""UNHCR said humanitarian assistance in Rwanda remains \""severely underfunded\"" which led to the decision by WFP to reduce food assistance by 10 per cent in November last year and by 25 per cent in January."",""The agency said its 2018 appeal for $98.8 million to support refugees in Rwanda is only is two per cent funded, while WFP warned of more food ration cuts if its $2.5 million monthly spend is not met."","""",""The council will be comprised of six civilians and five members of the military."",""The coming elections of 2020 could test Abiy Ahmed’s political staying power.""]",theeastafrican.co.ke/news/ea/Five-Congolese-refugees-shot-dead-in-Rwanda/4552908-4316716-format-xhtml-h70d1ez,22-02-18 19:00,Kenya
24572,Three suicide bombers kill 18 in Nigeria's Maiduguri: police,"[""MAIDUGURI, Nigeria (Reuters) - Three suicide bombers killed 18 people in the northeast Nigerian city of Maiduguri, capital of the state worst hit by the Boko Haram insurgency, its police commissioner said on Saturday."",""Nobody has claimed responsibility for the attack but the use of suicide bombers in crowded areas is a hallmark of the Islamist militant group, which has killed more that 20,000 people since 2009 and forced over two million to flee their homes."",""Damian Chukwu, police commissioner for Borno state, said the attack took place at a fish market around 20 kilometres (12 miles) from the centre of Maiduguri at about 8:00 p.m. (1900 GMT) on Friday."",""“The three suicide bombers were killed and 18 other persons died. Twenty-two people were injured,” said Chukwu."",""Suicide bombings have continued despite repeated assertions by the government and the military since 2016 to have defeated the Boko Haram insurgency, which aims to create an Islamic state in Nigeria’s northeast."",""President Muhammadu Buhari took office in 2015 with a promise to improve security for ordinary Nigerians."",""But in addition to the jihadist insurgency, communal violence has plagued swathes of the country in the last few months, including a clash on Thursday that killed 18.""]",reuters.com/article/us-nigeria-security/three-suicide-bombers-kill-18-in-nigerias-maiduguri-police-idUSKCN1G109D,16-02-18 19:00,
20328,"Suspected Boko Haram militants kill eight soldiers, one civilian in Nigeria's northeast: police","[""BAUCHI, Nigeria (Reuters) - Suspected Boko Haram militants killed eight soldiers and one civilian in an attack in Nigeria’s northeast, a police official said on Wednesday."",""The attack in Yobe state on Tuesday evening also left five civilians injured, Abdulmalik Sumonu, commissioner of police for Yobe, told Reuters by phone.""]",reuters.com/article/us-nigeria-security/suspected-boko-haram-militants-kill-eight-soldiers-one-civilian-in-nigerias-northeast-police-idUSKBN1CU2XL,24-10-17 20:00,
165942,12 killed as gunmen strike convoy with Mali election materials,"[""Gunmen attacked a convoy carrying election materials in central Mali, triggering a shootout in which four soldiers and eight attackers were killed, a Defence Ministry spokesman said by telephone on Wednesday."",""The spokesman said the attack occurred late on Tuesday on the road between Nampala and Coura in the south-central region of Segou, giving no further details."",""The party of Malian presidential candidate Soumaila Cisse said on Monday that the poll would go to a run-off between Cisse and President Ibrahim Keita, a day after a vote that was heavily disrupted by suspected Islamist gunmen."",""READ ALSO: Defection: All juicy appointments went to Katsina, Lagos, says Saraki"",""Cisse’s campaign manager, Tiebele Drame, made the announcement at the party’s headquarters in Bamako, the capital."",""Keita’s spokesman said the president was substantially in the lead according to provisional vote count, although he accepted that a run-off was possible."",""Spiralling jihadist violence has become a key issue in the campaign, as attacks multiply and the death toll mounts across north and central Mali."",""“The law forbids the proclamation of results by anyone except the Ministry of Territorial Administration,” Drame told a news conference."",""“However, I can tell you that we are going to a second round between Soumaila Cisse and Ibrahim Boubacar Keita.”"",""Mahamadou Camara, the spokesman for Keita, said, “According to our tally, IBK has come substantially ahead,” using the popular nickname for the president, taken from his initials."",""The exact numbers of voters who were disenfranchised by violence is not known, but they could easily become a flashpoint if the vote is close."",""Ministry of Territorial Administration figures showed that, of the roughly 23,000 polling stations that were meant to open, 4,632 were disrupted by “armed attacks or other violence,” of which 644 were unable to operate."",""In most of Mali, the vote was peaceful and relatively well organised, with polls opening and closing on time. Most people who were enrolled and turned up were able to vote."",""In the mud-walled medieval city of Timbuktu, once a flourishing tourist spot before Islamist militants made it too dangerous, witnesses said gunmen had intimidated voters, seized ballot boxes and in some cases set fire to them in the few polling stations that were attacked outside town."",""NAN reports that Islamist militants took over northern cities like Timbuktu in 2012 on the back of a Tuareg rebellion, imposing Sharia law with harsh penalties like cutting off fingers for smoking, until France intervened a year later to push them back. The Islamist militants regard democracy as an un-Islamic Western imposition."",""Since Keita came to power in the 2013 poll, Islamist violence has swept south into Mali’s fertile centre."",""UN mission chief Mahamat Annadif on Friday urged whoever wins the poll to urgently address jihadist-stoked ethnic violence in Mali’s central “breadbasket.”"",""The figures from the ministry showed that the central region of Mopti accounted for half of polling stations under attack."",""Hamid Bore, 39, a teacher, was in charge of one such station in the village of Dembere."",""The militants arrived just as polls opened at 8 a.m.(0800 GMT), he said."",""At a news conference, the head of the European Union observer mission welcomed the decision to make public the number of polling stations that had not been able to function but urged it to publish more precise information about which ones exactly."",""A second round would temporarily cool tensions."",""Cisse’s campaign has repeatedly accused Keita of tampering with the electoral list to try to steal the election."",""The UN is heaping pressure on all sides to accept the result — or at least contest it through legal channels — to avert a political crisis on top of the security woes the country is already facing."",""(Reuters/NAN)""]",punchng.com/%2a/12-killed-as-gunmen-strike-convoy-with-mali-election-materials/amp,31-07-18 20:00,Nigeria
303819,"Breaking:  Alan Garcia, Peru’s ex-president kills himself before arrest","[""Peru ex-president Alan Garcia dies after shooting himself: party official"",""Alan Garcia shot himself in the head at his home on Wednesday as police were about to arrest him in a sprawling corruption case, his lawyer and hospital officials said."",""Germany ready to accept some migrants from ship in Mediterranean"",""The 69-year-old Garcia was undergoing emergency surgery for “a bullet wound to his head” at the Casimiro Ulloa Emergency Hospital in Lima, the hospital said."",""Peru’s Health Minister Zulema Tomas said Garcia was in “very serious and critical” condition."",""“We’ve had to resuscitate him three times. He’s had three cardiac arrests,” said Tomas."",""“He is in a delicate condition and the prognosis is reserved,” added the health ministry, which said the bullet went straight through Garcia’s head."",""The attempted arrest took place at 6:30 a.m. (1130 GMT) at Garcia’s home in the posh Miraflores neighborhood of Lima."",""“This morning there was a regrettable accident: the president took the decision to shoot himself,” Erasmo Reyna, Garcia’s lawyer, told reporters outside the hospital."",""Garcia, who was president from 1985-90 and again from 2006-11, is suspected of having taken bribes from Brazilian construction giant Odebrecht in return for large-scale public works contracts."",""In November he sought refuge in the Uruguayan Embassy and applied for asylum but he left the next month after it was denied."",""He is one of four Peruvian ex-presidents embroiled in various corruption scandals alongside Pedro Pablo Kuczynski, Ollanta Humala and Alejandro Toledo."",""Odebrecht has admitted to paying $29 million in bribes to Peruvian officials over three administrations."",""Some of those payments were allegedly made during Garcia’s second term in office to secure a contract to build the Lima metro."",""Peruvian press reports also claim Garcia received a $100,000 payment from an illicit Odebrecht fund for giving a speech to Brazilian business leaders in Sao Paulo in May 2012.\nMore details soon ""]",vanguardngr.com/2019/04/breaking-alan-garcia-perus-ex-president-kills-himself-before-arrest,16-04-19 20:00,Nigeria
110549,Three killed as Israel and Hezbollah clash on Lebanese border,"[""TWO Israeli soldiers and a Spanish UN peacekeeper have been killed as Hezbollah militants traded fire with Israeli forces on the Lebanese border."",""After Israeli forces were hit by missile fire, they responded by firing shells into southern Lebanon."",""The UN Security Council is to discuss the fighting at an emergency meeting called by France in New York."",""A senior UN official on the ground in Lebanon urged “maximum restraint to prevent an escalation”."",""Israeli Prime Minister Benjamin Netanyahu held an emergency security meeting and said the attackers would “pay the full price”."",""The cross-border violence erupted when Israeli military vehicles were struck by anti-tank missiles at about 11:35 (09:35 GMT) near Mt Dov, in the Shebaa Farms area, a tract of land where the borders of Israel, Lebanon and Syria meet."",""Two soldiers died in the attack. Hezbollah said it was retaliation for an Israeli air strike that killed six of its fighters and an Iranian Revolutionary Guards general in the Syrian Golan Heights 10 days ago.Seven other Israeli soldiers were injured, two of them moderately.Just over an hour later, mortars hit an Israeli military position on Mt Hermon, prompting troops to close the site and evacuate civilians from a ski resort in the area."",""Israel struck back with combined aerial and ground strikes on Hezbollah operational positions along the border, the military said."",""At least 50 artillery shells were fired at the villages of Majidiyeh, Abbasiyeh and Kfar Chouba, according to Lebanese officials."",""Later, the UN Interim Force in Lebanon announced that one of its peacekeepers had been killed close to the Shebaa Farms area."",""The defence ministry in Madrid identified the dead man as a Spanish soldier who had been at a position near the village of Ghajar."",""The UN special co-ordinator for Lebanon, Sigrid Kaag, expressed “deep concern over the serious deterioration of the security situation” and “urgently called on all parties to refrain from any actions that could destabilise the situation further”."",""Edmond Mulet, assistant secretary-general for UN peacekeeping operations, is to brief the Security Council in closed consultations.After Israel’s surprise air strike inside Syria on 18 January, it was clear that Hezbollah and its Iranian backers would feel obliged to respond. The question now is whether the two sides will regard honour as satisfied by their responses so far."",""Everyone is mindful of the Hezbollah-Israel war of 2006, which lasted a month and caused death, destruction and disruption on both sides of the border without either side clearly winning."",""The feeling is that neither Hezbollah nor Israel has much interest in an escalation to that point. Hezbollah is already heavily embroiled in the war in Syria."",""Israel’s leaders face general elections in March. They could benefit if a robust response was seen to punish Hezbollah without repercussions, but a disruptive war could backfire at the polls.""]",guardian.ng/news/world/three-killed-as-israel-and-hezbollah-clash-on-lebanese-border,28-01-15 19:00,Nigeria
116738,German kidnapped in northern Nigeria,"[""Armed men on Monday kidnapped a German national working for a construction firm in northern Nigeria in an attack that also killed a police officer, police said."",""A gang of five men opened fire on a vehicle carrying workers to a construction site as they travelled through Kano city at about 7:45 am (0645 GMT), said police spokesman Magaji Musa Majia."",""“The attackers killed one police sergeant attached to (the) special protection unit on escort duty and abducted… a German national working with the company,” he added in a statement."",""“A manhunt for the abductors is ongoing.”"",""Kidnapping for ransom has been a problem for years in southern Nigeria, with the wealthy and influential, including family members of government ministers, regularly abducted for money."",""But in recent years the phenomenon has spread to the north, where criminals hit by a government crackdown on cattle rustling, have increasingly taken up the practice."",""In January, two Americans and two Canadians were kidnapped in an ambush that killed two of their police escorts in the northern state of Kaduna. They were released several days later."",""Two German archaeologists and even the Sierra Leone defence attache have been seized in Kaduna in recent years.""]",guardian.ng/news/german-kidnapped-in-northern-nigeria,15-04-18 20:00,Nigeria
454507,12 dead in suspected Mozambique Islamist attack,"[""Twelve people have been killed in a suspected Islamist attack in northern Mozambique, with thousands of villagers fleeing the area into neighbouring Tanzania, police sources said Sunday."",""Early Friday, \""there was an attack in Nangade district, where there are no security patrols. The attackers killed 12 people, mostly women and children,\"" a police source in Cabo Delgado province, who asked not to be named, told AFP."",""The attack took place in the village of Chicuaia Velha, just a few kilometres from Tanzania, forcing several thousand people to cross the border to seek safety, police said."",""A local journalist said the villagers were killed by machete or died when their houses were set on fire by the attackers."",""It was the third such incident in the last month in Cabo Delgado, leaving 20 dead in all."",""The authorities have responded with a crackdown, rounding up some 200 suspects."",""Over the past year, hardline Islamists have been active in the region, stoking unrest just as the government in Maputo is pushing ahead with oil and gas development in the province."",""Treasury seeks additional funding of $866m, increasing the 2019/2020 budget to $30.4bn."",""Did you clear the university study loan you received from the Higher Education Loans Board""]",theeastafrican.co.ke/news/africa/Suspected-Mozambique-Islamist-attack/4552902-4868170-format-xhtml-u46ry7z,24-11-18 19:00,Mozambique
