Column1,title,text,url,date,location
40370,4 Brigade Nigerian Army sets up enquiry over checkpoint killing by personnel,"[""The 4 Brigade, Nigerian Army, Benin, has set up a Regimental Board of Enquiry into circumstances that allegedly led a soldier to kill a man for refusing to bribe him at a checkpoint."",""A statement on Saturday in Benin by Capt. Mohammed Maidawa, Assistant Director, Army Public Relations and made available to the News Agency of Nigeria (NAN), said the brigade’s attention had been drawn to the incident."",""Maidawa said the attention of the Headquarters of the Brigade was drawn to the incident through an online publication alleging that the soldier killed a truck driver who refused to bribe him at a checkpoint."",""He said the incidence allegedly occurred at a checkpoint manned by troops of 195 Battalion on Agbor Road."",""He said it was alleged that the soldier killed the driver over the deceased’s refusal to give bribe at a checkpoint."",""He, however, said it was important to put the records straight and that led to the board of enquiry."",""According to him, soldiers on routine Stop and Search Operation at Uromi shot at a moving truck that tried to evade checks."",""He said unfortunately, a civilian was hit by a bullet and was immediately rushed to a hospital at Uromi where he gave up."",""According to him, the ugly incident resulted to protest by truck drivers who initially blocked Benin Express Way at Ewu junction but later cleared their trucks and normal traffic continued."",""Maidawa further said that while the Brigade commiserated with the family of the deceased, the army as a professional force, would not condone any act of misdemeanor by troops deployed on Internal Security Operations or any other operation."",""He stated that in view of this, the soldier had been arrested and a Regimental Board of Inquiry had been constituted to unravel the circumstances."",""“I want to assure the general public that the Nigerian Army will continue to carry out its operations in line with the Rules of Engagement for internal security operations."",""“The general public, particularly those plying the highways, should be assured that the Brigade places high premium on the sanctity of human lives,” he further said.""]",guardian.ng/news/4-brigade-nigerian-army-sets-up-enquiry-over-checkpoint-killing-by-personnel,15-12-17 19:00,Nigeria
346717,Clash between vigilantes and extremists kills at least 25 in Nigeria,"[""MAIDUGURI, Nigeria (AP) - In attacks and reprisals between an Islamic militant group and vigilantes, at least 25 civilians were killed in northeast Nigeria, a vigilante group said Sunday."",""It was the first attack with major fatalities reported since dozens of students were killed earlier this month in attacks blamed on Boko Haram, the militant group whose name means \""Western education is forbidden.\"""",""Nigeria's military has said the situation has been brought under control since thousands of troops were moved into the region after the government imposed a state of emergency on May 14 and conceded that extremists were controlling towns and villages in the northeast of Nigeria, Africa's most populous nation and its largest oil producer."",""Mixed messages since then have the military claiming control and intermittent attacks by the extremists."",""Vigilante leader Aliko Musa said Sunday that his group stormed villages over the weekend to hunt Boko Haram members. He said they retaliated with big fire power and that five vigilantes and 20 civilians -- mostly fishermen and traders -- were killed."",""Lt. Haruna Muhammed Sani of Nigeria's military said 20 civilians and one vigilante were killed in the violence."",""There was no way to confirm either account in an area in which the military has cut cellphone and Internet connections.""]",ap.com/Clash between vigilantes and extremists kills at least 25 in Nigeria,27-07-13 20:00,
31194,Vigilantes and Boko Haram clash in Nigeria,"[""Residents in northeast Nigeria say at least 13 vigilantes and five Boko Haram members have been killed after the group launched attacks on a town."",""Sunday's attack in Benisheik, 72km west of Maiduguri, took place days after the military said it killed at least 50 fighters in an area to the north."",""Zannah Fannami, an injured operative with the Civilian Joint Task Force, said they were attacked while awaiting Boko Haram's approach on the town."",""He said the vigilante group was able to kill five suspected members of the armed group. Another Civilian-JTF operative, Muhammed Abuwar, said the military did not assist the vigilantes and 18 others were injured.Al Jazeera's Yvonne Ndege, reporting from Abuja, said it was unclear why Boko Haram might have attacked the town except for the fact that they might have known it was being guarded by citizens and not the military."",""Ndege said the recent spike in attacks had not prompted any comment from the military regarding consolidating security in the northeastern part of the country."",""The military has agreed to support any missions by the Civilian-JTF until its newest 7th Division fully formed to fight Boko Haram is fully functional."",""The spokesman for that division, Lieutenant Colonel Sagir Musa, said that brigade troops were sent to the area and \""the attack was repelled\""."",""Troops are still searching for fleeing insurgents, he said."",""There has been a rash of attacks by suspected Boko Haram members in northeast Nigeria recently, after young vigilantes formed the Civilian-JTF in June."",""The vigilante force claims credit for thousands of arrests in Maiduguri and many killings."",""More than 160 people were killed in violence linked to Boko Haram last month - one of the bloodiest periods since President Goodluck Jonathan declared a state of emergency and a military crackdown in three northeastern states in mid-May."",""Since 2009, an estimated 3,600 people have been killed in an insurgency launched by Boko Haram, which says it wants to establish an Islamic state in the northeastern part of the country."",""While the group has repeatedly attacked schools, churches, mosques and markets, state institutions like police stations and military facilities have remained primary targets.""]",aljazeera.com/news/africa/2013/09/20139818515940397,08-09-13 17:07,
45628,At least 42 dead in rebel-IS clashes near Damascus: monitor,"[""At least 42 fighters were killed in 24 hours of fierce fighting between Islamist rebels and the Islamic State group in Syria’s Damascus province, a monitoring group said Wednesday."",""“At least 30 Islamist rebels and 12 fighters from IS were killed in fighting since Tuesday” in the hilly region of Qalamun, the Syrian Observatory for Human Rights said."",""Qalamun is divided into a western portion, which borders Lebanon and is mostly controlled by the regime and its ally, the Lebanese Shiite movement Hezbollah."",""The eastern sector has seen intense clashes between rebels and IS, and is strategic because it borders the “badiya,” the Syrian steppe."",""These plains are used by rebels to transport weapons from the Turkish border to the north and the Jordanian frontier in the south."",""According to the Britain-based Observatory, IS has already cut off one of these routes and aims to take more to “suffocate” the rebels."",""Meanwhile, at least 11 people were killed in regime bombardment of two towns in Damascus province."",""“It is likely that there were even more killed in the attack, and the number will increase due to people in a critical condition,” said Observatory head Rami Abdel Rahman."",""In the northern Aleppo province, 12 people were killed and at least 40 others injured in regime aerial attacks on Deir al-Hafir, a town under the control of IS militants."",""“There are still people stuck in the buildings after they collapsed,” said Abdel Rahman."",""Thirteen civilians, including nine children, were killed Tuesday night in shelling in the northwest province of Idlib, whose provincial capital was overrun by al-Qaeda’s Syrian affiliate and allied rebels."",""Among them, a man and five children, three of them sisters, were killed in a regime air raid on Maarat al-Numan."",""Seven others, including a couple and their four children, were killed by rebel shelling on Jisr al-Shughur, one of the last regime-held cities in Idlib province."",""Since they lost control of Idlib city, regime forces have been trying to chip away at opposition-controlled parts of the province to protect their supply route between Ariha and Jisr al-Shughur.""]",guardian.ng/news/at-least-42-dead-in-rebel-is-clashes-near-damascus-monitor,21-04-15 20:00,Nigeria
12155,Chadian soldiers kill 207 Boko Haram fighters in Nigeria: army,"[""N’DJAMENA (Reuters) - Soldiers from Chad killed 207 Boko Haram militants in fighting on Tuesday near a Nigerian town close to the border with Cameroon, Chad’s army announced in a statement."",""One Chadian soldier was killed and another nine were wounded in the clashes near Gambaru, the scene of regular attacks by the Nigerian Islamist group in recent months. There was no immediate independent verification of the Chadian army’s announcement."",""Chad’s military also claimed to have seized large quantities of small arms and ammunition and two pick-up trucks."",""Niger, Cameroon and Chad have launched a regional military campaign to help Nigeria defeat the Boko Haram insurgency, which aims to carve an Islamic emirate out of northeastern Nigeria."",""Chad deployed troops last month in support of Cameroonian efforts to stop repeated cross-border raids by the Islamists, whose operations increasingly threaten Nigeria’s neighbors."",""The African Union last month authorized the creation of the regional force, which will also include Benin, and is pushing for a U.N. Security Council mandate for the operation.""]",reuters.com/article/us-nigeria-violence-chad-idUSKBN0LT0Y520150225,24-02-15 19:00,
347896,Authorities: At least 11 killed by Islamic extremists in attack on northeast Nigeria village,"[""YOLA, Nigeria (AP) - Authorities in northeast Nigeria say at least 11 people were killed in a gun and machete attack carried out by radical Islamic extremists in a northeast Nigeria village."",""Adamawa state police spokesman Mohammed Ibrahim said the attacker hit the village of Midlu early Saturday morning, targeting the house of the state's deputy governor during their assault."",""Ibrahim said victims had their throats slit. Villagers living there said the attackers called out some of their victims by name, suggesting that the assailants had particular people they wanted dead."",""No arrests were immediately made in the attack, which comes as northern Nigeria faces near-daily attacks by Islamic extremists. The main extremist network there, known as Boko Haram, has been launching attacks since 2010, despite an increased deployment of soldiers and police there.""]",ap.com/Authorities: At least 11 killed by Islamic extremists in attack on northeast Nigeria village,05-04-13 20:00,
148238,Boko Haram kills six soldiers in Borno,"[""At least six soldiers died in two separate Boko Haram ambushes in Borno State, military and civilian militia sources said on Monday."",""Four troops were killed and 12 injured on Sunday when their convoy was attacked near Damboa, 90 kilometres (56 miles) from Maiduguri, the capital of Borno state."",""Two soldiers were killed in the same area on Saturday, the sources told AFP, speaking on condition of anonymity as they were not allowed to talk to the media."",""A military officer in Maiduguri said Sunday’s ambush happened when troops were on patrol between the villages of Nyeneri and Falawani."",""“The terrorists came in huge numbers and attacked the convoy using IEDs (improvised explosive devices) and gun trucks,” he added."",""A member of the civilian self-defence force gave a similar account and death toll, and said the jihadists made off with weapons before reinforcements arrived."",""He added: “Two soldiers died on Saturday when the six vehicles they travelling in came under heavy attack from Boko Haram near Bulaburin (village),” said the militia source."",""The attacks came days after the military replaced the officer leading troops fighting Boko Haram following a surge in attacks, including against military outposts."",""The army maintains the redeployment of Major-General Ibrahim Attahiru was routine, and the officer himself said suggestions he was sacked are “far from the truth”."",""He said in his farewell speech to troops on Monday that his move was “a normal exercise” and his redeployment to army headquarters in Abuja was a “call to higher responsibility”."",""Meanwhile, hundreds of people displaced by the violence deserted a makeshift camp in Birimari village, in the Nganzai district of Borno, some 80 km north of Maiduguri."",""Troops had been sent to the village, which is the birthplace of Borno state governor Kashim Shettima, two years ago but soldiers were withdrawn last week, locals said."",""One of the displaced, Idrissa Karim, fled with others to Gajiram, the district headquarters, as fears spread of a possible attack."",""A bus driver who plies the route from the garrison town of Monguno to Maiduguri, which passes through Birimari and Gajiram, confirmed the displaced people had moved on."",""“The IDPs (internally displaced persons) were packing their tents and few belongings from the camp at Birimari and heading to Gajiram for fear of Boko Haram attack after soldiers left the village,” the driver said."",""As well as leaving at least 20,000 dead, the eight-year conflict has forced millions from their homes. IDPs remain vulnerable because of a lack of security in camps and elsewhere."",""AFP""]",punchng.com/boko-haram-kills-six-soldiers-in-borno,10-12-17 19:00,Nigeria
337401,"22 killed in overnight violence in and around Kenyan capital, police say","[""NAIROBI, Kenya (AP) - A wave of violence across the Kenyan capital killed 22 people early Friday, and police were investigating whether a shadowy gang that has threatened to launch an uprising against the government was involved in at least some of the deaths.   "",""Several of the attacks had the hallmarks of the Mungiki gang, which is accused in a string of beheadings and whose founder was sentenced to prison just hours before the violence erupted. Three of the victims were beheaded, and the Kariobangi neighborhood where at least eight people died is known to be an area where Mungiki operates.   "",""Kiplimo Rugut, the commissioner of Central Province, said Mungiki was suspected in some of the killings, which happened overnight. \""This is a possibility we are looking at,\"" he told The Associated Press.   "",""The violence comes at a tumultuous time in the Kenyan capital, where an explosion earlier this month killed one person and wounded more than 30 during rush hour. No one has claimed responsibility for the blast. In the past month, more than 50 people have been killed in a crime spree and police crackdown linked to Mungiki.   "",""Mungiki claims to have thousands of adherents, all drawn from the Kikuyu, Kenya's largest tribe. The group, whose name means \""multitude\"" in the Kikuyu language, was inspired by the bloody Mau Mau rebellion of the 1950s against British colonial rule. In recent years, it has been linked to extortion, murder and political violence.   "",""The group's founder, Maina Njenga, who has publicly denied links to Mungiki recently but who is widely believed to still be a guiding force, was sentenced to five years in prison Thursday on gun and drug charges.   "",""Meanwhile, a Mungiki leader said the government crackdown has done nothing to stop the secretive group, which makes money by demanding protection payments from minibus drivers and by controlling illegal businesses that produce homemade alcohol or provide electricity to slum areas by rerouting the circuits.   "",""The minibuses, known as matatus, are the main form of public transportation in Kenya.   "",""\""Nothing has changed,\"" the leader told The Associated Press, insisting his name not be published because he is wanted by police. \""Most politicians in this area are affiliated with us in one way or another.\""   "",""He spoke the day before Friday's violence, and could not be reached for further comment.   "",""A senior police officer, who also requested anonymity due to the sensitivity of the matter, said corruption is the main reason authorities cannot stamp out the Mungiki.   "",""He said officers round people up, then take bribes to release them. \""The officers also tip members of the group to an impending raid,\"" he said.   "",""Simon Kimutai, head of the Matatu Owners Association, said the Mungiki have become so threatening that he is forced to work from his car so gangsters won't find him at his office.   "",""\""I am talking about (the Mungiki) every day and nothing is happening, so what will happen next is that they will come for my head,\"" he said.   "",""Mungiki members have threatened to disrupt the elections in December, when President Mwai Kibaki will seek a second term. Leaflets circulated by the group call on Kenyan youth to join up and prepare for an uprising against the government.   "",""\""Arise! Arise! Arise!\"" one of the leaflets says. \""Stand up for your rights now.\""   "",""Clashes have broken out every election year since 1992, and this year has been no different. Besides the Mungiki violence, land disputes in the Mount Elgon area, 515 kilometers (320 miles) northwest of Nairobi, have killed more than 140 people and forced tens of thousands from their homes.   "",""Much of Friday's violence took place in Banana Hill -- the base of a lucrative matatu route -- and the eastern Nairobi neighborhood of Kariobangi, where residents have long complained that Mungiki runs vast extortion rackets. Three corpses, included two who were beheaded, were found in Banana Hill, on the outskirts of Nairobi, police said.   "",""Another beheaded victim was found in the city center, said police official Tito Kilonzi said.   "",""\""If you look at the way beheading was done, it leaves us with little doubt that it was Mungiki,\"" he said.   "",""The violence in and around Kariobangi killed eight people, starting when gunmen stormed a restaurant and opened fire, said police official Maina Migwi. A truck driver and two passengers also were killed, he said.   "",""\""They did not steal anything from the victims in all the incidents last night,\"" Migwi said, suggesting that the violence was a way to instill terror in the area.   "",""Police also fatally shot eight men who were trying to rob a warehouse of the  Kenya Electricity Generating Company Ltd., said Julius Muthuri, police official in Nairobi's industrial area. KenGen produces about 80 percent of the electricity consumed in the country.   "",""Police spokesman Eric Kiraithe said authorities believe the suspects at KenGen were trying to steal materials to use for illegal electricity connections -- a hallmark, he said, of the Mungiki sect.   ""]","ap.com/22 killed in overnight violence in and around Kenyan capital, police say",21-06-07 20:00,
90268,Qaeda kills three in sweep of Yemen’s south,"[""Al-Qaeda militants killed three pro-government fighters Saturday as they strengthened their presence in the southern coastal town of Ahwar, residents and military officials said."",""The jihadists launched an attack at dawn on a checkpoint manned by fighters close to the government of President Abedrabbo Mansour Hadi, the sources said."",""They captured three of them before slitting their throats and going on to seize several government buildings."",""Al-Qaeda militants have controlled several neighbourhoods of the town in Abyan province for several weeks, according to the military officials."",""The Sunni Muslim extremist group has shored up its presence in Abyan where it already controls the provincial capital Zinjibar and the towns of Jaar and Shaqra."",""Their advance gives them control of most of the coast from their southeastern stronghold of Mukalla to Zinjibar, not far from the main southern port city of Aden."",""Hadi’s internationally recognised government declared Aden the country’s provisional capital in March, after Shiite Huthi rebels drove it out of Sanaa and much of northern Yemen."",""Al-Qaeda and the Islamic State group have stepped up attacks on Aden despite the government’s efforts to secure the city.""]",guardian.ng/news/qaeda-kills-three-in-sweep-of-yemens-south,19-02-16 19:00,Nigeria
