Column1,title,text,url,date,location
88332,Police kill two gunmen at US Mohammed cartoon event,"[""Police shot dead two gunmen Sunday outside a Prophet Mohammed cartoon contest in Texas attended by Dutch far-right politician Geert Wilders, authorities said."",""While no immediate claim of responsibility was made, similar depictions of the Prophet Mohammed prompted a shooting at French satirical weekly Charlie Hebdo in January that killed 12 people."",""US authorities are investigating the shooting and police said it was still unclear if the attack was related to the event."",""The right-wing American Freedom Defense Initiative (AFDI) organized the event in a suburb of Dallas, featuring Wilders, who has been outspoken against Muslims and is targeted by radical groups."",""Police said two men drove up to the conference center in Garland, Texas, and began shooting at a security guard."",""“Garland Police officers engaged the gunmen, who were both shot and killed,” the city of Garland said in a statement."",""The security guard was shot in the ankle and was treated at a hospital and released, the city said."",""Local police said the shootout lasted “seconds,” and organizers said they had prepared extra security for the event due to the general risk of an attack."",""Wilders has long been targeted by Islamists because of his extreme views on Islam."",""“I am shocked. I just spoke for half an hour about the cartoons, Islam and freedom of speech and I had just left the premises,” Wilder told AFP in an email."",""“This is an attack on the liberties of all of us!” Wilders wrote, adding: “I hope it is not connected to death list (of) Al-Qaeda.” He added that he was safe with police."",""The Dutch politician said he is returning to the Netherlands Monday but would come back to the United States next week for another speaking engagement."",""– Prophet Mohammed cartoons –"",""Many Muslims find depictions of the Prophet Mohammed offensive and such cartoons have triggered violent protests. The Danish daily Jyllands-Posten published 12 satirical cartoons in 2005, triggering deadly protests in some Muslim countries."",""Cartoon images of the Prophet Mohammed were also published in French satirical weekly Charlie Hebdo in Paris, where Islamist gunmen killed 17 people during three days of attacks in January, including 12 at the magazine itself."",""The identities of Sunday’s shooters have yet to be confirmed, but the SITE Intelligence Group reported that an Islamic State (IS) fighter claimed on Twitter that the shooting was carried out by two pro-IS individuals."",""In a series of tweets, a jihadist named as Abu Hussain AlBritani, which SITE said was British IS fighter Junaid Hussain, claimed that “2 of our brothers just opened fire” at the Prophet Muhammad exhibition in Texas."",""“They Thought They Was Safe In Texas From The Soldiers of The Islamic State,” added the tweet."",""About 200 people were inside the event, said local police spokesman Joe Harn."",""He said the first suspect was shot dead immediately, while the second was shot after reaching for his backpack."",""Police said they suspect the gunmen’s vehicle may contain an “incendiary device” and a bomb squad was on the scene."",""“The bodies are still outside near the car. Once that car is cleared then we’ll take care of the bodies,” he told reporters."",""A hotel in the suburban area was evacuated, and nearby roads were closed off, local residents said."",""AFDI, criticized for promoting anti-Islamic views, offered a $10,000 prize for the winner of the cartoon contest that was billed as a “free speech” event."",""AFDI co-founder and political activist Pamela Geller called the shootings a “war on free speech.”"",""“What are we going to do? Are we going to surrender to these monsters?” she wrote on her website."",""“The war is here.”"",""Speaking to Fox News, she added: “The idea we are going to bridge our freedom, our most basic inalienable right in order to not offend savages is egregious, it is outrageous."",""An attendee at the event said the shooting prompted a patriotic outburst."",""“Everyone sang God Bless America, and the Pledge of Allegiance,” political activist Katrina Pierson told Fox News."",""Pierson said the cartoon event was about standing up for free speech."",""“It was a moment in our country, particularly here in the state of Texas, for many of us to stand up for that right.”""]",guardian.ng/news/police-kill-two-gunmen-at-us-mohammed-cartoon-event,03-05-15 20:00,Nigeria
11803,"U.N. says team attacked on Nigeria-Cameroon border, five dead","[""DAKAR (Reuters) - An armed group attacked a U.N. technical team working along the border between Nigeria and Cameroon, killing five people and wounding several, the United Nations Office for West Africa said on Wednesday."",""The attack occurred on Tuesday at around 1400 local time near the Cameroonian border town of Kontcha, the statement said."",""“The victims were one U.N. independent contractor, three Nigerian nationals and one Cameroonian national,” it added.""]",reuters.com/article/us-nigeria-security-cameroon-idUSKBN15G4UB,31-01-17 19:00,
3623,Blast kills at least 21 at mosque in northeast Nigeria's Maiduguri,"[""MAIDUGURI, Nigeria, March 16 (Reuters) - At least 21 people have been killed and 32 were injured in a suicide bomb attack at a mosque in the northeast Nigerian city of Maiduguri on Wednesday, a military source and a civilian joint task force member said."",""No group has claimed responsibility for the attack, the first since 65 people were killed on the outskirts of the city at the end of January, but it bore the hallmarks of Islamist militant group Boko Haram.   (Reporting by Lanre Ola; Writing by Alexis Akwagyiram; Editing by Toby Chopra)""]",reuters.com/article/nigeria-blast-idUSL5N16O23F,,
8391,Three Kenyan soldiers wounded in gun attack near Somali border,"[""MOMBASA (Reuters) - Gunmen attacked a truck carrying Kenyan soldiers near the border with Somalia on Thursday, seriously wounding three of them, police said, in an assault that bore the hallmarks of Somalia’s Islamist militant group al Shabaab."",""Attacks on civilians and security forces have killed well over 200 people since 2013. Concerns about security have battered Kenya’s tourism industry, including during this holiday season."",""“The soldiers were going to fetch water from a borehole in Mangai village, Lamu East, when militia attacked them by shooting at their lorry,” Lamu County police commander Ephantus Kiura said."",""“Three soldiers were critically injured in the incident and were airlifted to a nearby naval base where they are receiving treatment.”"",""The attack took place some 80 km from Lamu island - an ancient trading port and popular tourist resort - and about 100 km from the site of attacks last June and July in which gunmen killed about 100 people."",""The al Qaeda-linked al Shabaab claimed responsibility for those attacks, saying it would continue its assaults to persuade Kenya to pull its troops out of Somalia, where its forces have joined other African Union troops battling the militants."",""A spokesman for the militant group could not immediately be reached."",""Thursday’s attack was similar to an incident last June in which two soldiers were killed after the truck they were using to ferry food to their colleagues in Somalia was attacked after it stalled. Al Shabaab claimed responsibility."",""Militia also shot at a bus ferrying passengers from Lamu to Mombasa in December, prompting owners of buses using the route to demand an armed escort."",""Lamu County has been under heightened security, including a dusk to dawn curfew that local businesses say has flattened the county’s tourism industry."",""“It is sad that even our soldiers who are armed are being attacked. It makes us wonder who is safe, especially the defenceless civilians,” said Francis Auma from HAKI Africa, a civil rights group in Mombasa.""]",reuters.com/article/us-kenya-attacks-idUSKBN0KA1T020150101,31-12-14 19:00,
151651,BREAKING: Three peacekeepers killed in northern Mali attack,"[""Three United Nations peacekeepers were killed and eight others wounded when they came under sustained attack in Kidal in Mali’s troubled north, the UN said Friday."",""The camp “came under heavy rocket/mortar fire” and “a little later a position nearby was attacked” outside the base, the UN mission in Mali, MINUSMA, said."",""AFP""]",punchng.com/breaking-three-peacekeepers-killed-in-northern-mali-attack,08-06-17 20:00,Nigeria
344479,Witnesses: At least 7 people killed in coordinated attacks by Islamist sect in north Nigeria,"[""KANO, Nigeria (AP) - Witnesses: At least 7 people killed in coordinated attacks by Islamist sect in north Nigeria.""]",ap.com/Witnesses: At least 7 people killed in coordinated attacks by Islamist sect in north Nigeria,19-01-12 19:00,
266822,Roadside bomb kills three vigilantes in Borno,"[""Three civilian vigilantes on their way to fight Boko Haram in northeast Nigeria were killed and seven others injured when their vehicle hit a landmine, residents told AFP on Tuesday. "",""The vigilantes from Chul village in Borno state were moving on Monday evening to battle Boko Haram militants who had stormed the neighbouring village of Huyum when the accident occurred. "",""“We lost three of our colleagues to a roadside bomb yesterday evening on their way to repel Boko Haram in Huyum,” said Adamu Galadima, a vigilante in the town of Askira Uba. "",""“The vigilantes were approaching Huyum, which was under Boko Haram attack, when the front tyre of their vehicle hit a bomb planted by the attackers”, said Galadima, who attended the victims’ funerals. "",""Boko Haram fighters had anticipated that soldiers from Askira or vigilantes from nearby hamlets, would use the roads and planted bombs to slow them down, said Huyum resident Peter Malgwui. "",""“Vigilantes from Chul heard of the attack and rushed to counter the Boko Haram gunmen when they hit the bomb, killing three and injuring seven,” added Malgwui, who fled following the attack."",""Boko Haram gunmen travelling in an open van attacked Huyum at about 7:30 pm (1830 GMT), firing indiscriminately and forcing residents to flee into the bush, he said."",""A woman was shot dead in the attack while a girl was shot and injured in the leg, he added."",""The gunmen were believed to have come from nearby Sambisa forest, which has long been Boko Haram’s enclave and base. "",""On June 8 last year Boko Haram killed 15 in a sweeping raid on Huyum, torching the entire farming village using petrol after looting food supplies and livestock. "",""Months later, residents who fled that attack began returning to the village to rebuild their homes following a series of successes by the military against Boko Haram."",""Nigeria maintains the sustained counter-offensive has left Boko Haram “technically” defeated but sporadic attacks continue, including in northern Cameroon. ""]",vanguardngr.com/2016/03/roadside-bomb-kills-three-vigilantes-in-borno,14-03-16 20:00,Nigeria
39364,"12 dead, 31 wounded in Kabul attack","[""At least 12 people were killed and 31 wounded when a suicide attacker blew himself up outside a government ministry in Kabul on Monday, officials said, as employees were leaving their offices early for Ramadan."",""There was no immediate claim of responsibility for the latest attack in the Afghan capital, but it comes a day before the government’s ceasefire with the Taliban is expected to start."",""Health ministry spokesman Waheed Majroh said at least 12 people were killed and 31 wounded in the explosion that happened at the main gate of the Ministry of Rural Rehabilitation and Development."",""Employees were gathered at the entrance of the compound waiting for a bus to take them home when the suicide bomber blew himself up among the crowd, said rural ministry spokesman Faridoon Azhand, who was inside the building at the time."",""“Unfortunately we have lost some colleagues,” Azhand told AFP. "",""Police spokesman Hashmat Stanikzai confirmed at least 12 people had been killed, including women, and another 20 wounded."",""Employees were leaving their offices at 1:00 pm (0830 GMT) due to the holy month of Ramadan, when most Muslims fast from sunrise to sunset, when the suicide attacker struck."",""Employees inside the ministry at the time of the attack confirmed hearing a blast."",""“An explosion happened at the exit gate of the ministry,” Daud Naimi, director of the communications department at the ministry, told AFP."",""“I was in my office when I heard a big blast,” another employee told AFP."",""“Most of my colleagues were leaving for the day to go home. I am worried about my colleagues. We are told to stay inside for now.”"",""Afghan President Ashraf Ghani on Thursday announced security forces would halt hostilities with the Taliban for a week."",""It would last from the “27th of Ramadan until the fifth day of Eid-al-Fitr”, he said, indicating it could run from June 12-19."",""The Taliban said Saturday their fighters would stop attacking Afghan security forces, but only for the first three days of Eid, the holiday capping Ramadan."",""It is the first time the militants have agreed to suspend fighting since the 2001 US invasion, and the move was largely welcomed by war-weary Afghans."",""Afghan security forces and the Taliban have vowed to retaliate if attacked during the ceasefire."",""The militants have also said their ceasefire does not extend to US-led NATO forces, while Kabul said operations against foreign fighters including the Islamic State group will continue.""]",guardian.ng/news/12-dead-31-wounded-in-kabul-attack,10-06-18 20:00,Nigeria
123637,Suicide bomber kills at least 20 at funeral in Iraq,"[""A suicide bomber killed at least 20 people by detonating an explosive belt at a funeral northeast of the Iraqi capital on Monday, security officials said."",""The blast in Muqdadiyah, which was hit by revenge attacks on homes and mosques after a January suicide bombing, also wounded at least 40 people."",""The bombing targeted a funeral for a well-known member of the Beni Tamim, one of the main tribes in Diyala province, where Muqdadiyah is located, officials said."",""There was no immediate claim of responsibility for the attack, but suicide bombings are a tactic almost exclusively employed in Iraq by the Islamic State jihadist group."",""The Muqdadiyah attack came a day after bombings in a Shiite area of northern Baghdad killed at least 39 people and wounded at least 76, the deadliest attacks in the capital so far this year."",""IS, a Sunni extremist group, said in an online statement that two of its suicide bombers carried out the Baghdad attacks."",""IS also claimed bombings at a cafe in Muqdadiyah killed at least 20 people and wounded dozens in January, after which revenge attacks targeted Sunni properties in the area."",""Human Rights Watch said Shiite militiamen abducted and killed civilians in the Muqdadiyah area after the attack, in addition to burning homes and mosques."",""Iraq turned to Shiite militia forces in 2014 to help counter an IS onslaught that overran large areas north and west of Baghdad in 2014, and they played a key role in halting the jihadist advance and later pushing them back."",""But they have also carried out repeated abuses during the conflict that ultimately feed mistrust of the government and are harmful to Baghdad’s efforts to reassert and maintain control in recaptured areas.""]",guardian.ng/news/suicide-bomber-kills-at-least-20-at-funeral-in-iraq,28-02-16 19:00,Nigeria
347574,"Gunman in volatile northern Mali village opens fire, killing 3 at aid distribution spot","[""BAMAKO, Mali (AP) - A suspected jihadist opened fire on a crowd at an aid distribution point in a north Malian village, killing three civilians, a local official said."",""However, at least one local jihadist leader said the suspect was not a member of the radical groups who ruled the region for nearly 10 months until a French-led military operation was launched in January to oust them from power."",""Abda Ag Kazina, the deputy mayor of nearby Kidal, said the attack took place Saturday in the village of Ikadiwane, north of Menaka, where an attempted suicide bombing had taken place on Friday. The jihadist group MUJAO or Movement for Oneness and Jihad in West Africa, claimed responsibility for that attack."",""\""The man cried `Allah Akbar, Allahou Akbar' and opened fire on the crowd, killing three people and seriously wounding another,\"" he told The Associated Press."",""A former member of the national police who was at the scene shot and wounded the suspect, who then was taken to Kidal."",""\""We don't know for the time being whether it's an Islamist or even what his motive was,\"" the deputy mayor said."",""Alghabass Ag Intalla, who heads the recently-created Islamic Movement of the Azawad, denied that the attacker who opened fire was a member of the radical groups who ruled the region for nearly 10 months until a French-led military operation was launched in January to oust them from power."",""The attack on civilians could mark a change in strategy for the extremists who previously have only targeted military checkpoints and installations in suicide bombings, causing military casualties. So far civilians have not been directly targeted."",""\""It's not an Islamist -- he doesn't belong to MUJAO or to any other group,\"" Intalla told the AP by telephone. \""It's a criminal and we are going to try him. Everyone can cry `Allahou Akbar' but that doesn't make them an Islamist.\"""",""While the French-led military offensive ousted radical jihadists from the major towns of the region, they have regrouped in outlying areas and launched a number of attacks. The unrest has raised fears about how secure northern Mali will be once France reduces its presence, as it plans to have only 1,000 troops left by year-end from a peak deployment of about 4,000.""]","ap.com/Gunman in volatile northern Mali village opens fire, killing 3 at aid distribution spot",12-05-13 20:00,
293114,At least four killed in open-air mosque suicide bombing in Borno,"[""At least four people were killed in northeast Nigeria on Thursday in a suicide blast at an open-air mosque, militia and refugee camp officials told AFP. "",""The suspected Boko Haram bomber, who requested anonymity, was disguised as a worshipper, detonated his explosives at a camp for people displaced by the insurgency in Dikwa, a town 90 kilometres (55 miles) east of Maiduguri, the Borno state capital. "",""“Early this morning a suicide bomber killed four people and injured 15 others when he detonated his explosives as people gathered to pray at the ‘1,000’ camp in Dikwa,” militia leader Babakura Kolo told AFP."",""An official at the camp, who , said that “the attack by a male suicide bomber happened at 5:17 am (0415 GMT)”."",""“We lost four people in the attack and 15 others sustained injuries and are in hospital receiving medical care,” he said."",""Dikwa is home to more than 70,000 displaced people from the war-torn region who live in several camps scattered across the town, relying on food handouts from aid agencies to survive."",""The attack came two days after a suicide bomber killed five militia members fighting Boko Haram jihadists in the town of Konduga, which lies 35 kilometres southeast of Maiduguri. "",""Boko Haram’s nine-year quest to carve out an Islamic state in northeast Nigeria has led to the deaths of 20,000 people and forced hundreds of thousands more from their homes."",""The militant group has been weakened since it controlled swathes of territory in 2014 but attacks still persist."",""The jihadists frequently use suicide bombers, many of them women and young girls, to target military checkpoints, mosques, markets and other crowded places."",""On May 1, an estimated 86 people were killed in twin suicide blasts targeting a mosque and a nearby market in the town of Mubi in neighbouring Adamawa state.""]",vanguardngr.com/2018/05/least-four-killed-ne-nigeria-suicide-bombing,16-05-18 20:00,Nigeria
119574,Nearly 70 killed in fresh Yemen fighting,"[""Air strikes and heavy clashes between rebel and pro-government forces in Yemen had killed at least 66 people in 24 hours, medics and security sources said Sunday."",""Air raids by a Saudi-led coalition and fighting near the strategic Bab al-Mandab strait killed at least 52 fighters among Shiite Huthi rebels and allied troops loyal to ex-president Ali Abdullah Saleh, the sources said."",""Fourteen members of pro-government forces were also killed."",""The rebels took their dead to a military hospital in Hodeida, a major western port city they control, a medical source told AFP."",""The hospital received 14 dead on Saturday and 38 on Sunday, as well as 55 wounded rebels, the source said."",""On the pro-government side, 14 soldiers were killed and 22 wounded, according to medics in the southern port city of Aden where President Abedrabbo Mansour Hadi’s government is based."",""Coalition warplanes and Apache attack helicopters have been pounding rebels for several days in support of pro-Hadi forces attempting to retake the Red Sea city of Mokha, military sources said."",""Pro-Hadi forces launched the vast offensive on January 7 to retake the region overlooking the Bab al-Mandab strait, a key maritime route connecting the Red Sea and the Indian Ocean."",""By Sunday, loyalist forces were within 10 kilometres (six miles) of Mokha, they said, but the offensive has been slowed by mines laid by rebel forces.""]",guardian.ng/news/nearly-70-killed-in-fresh-yemen-fighting,21-01-17 19:00,Nigeria
198729,Seven killed in Lokichogio school attack,"[""Seven people have been killed among them students after a militia stormed Lokichogio Secondary School in Turkana in suspected revenge attack."",""Four students who were seriously injured during the attack have been rushed to Lopiding Sub County Hospital for treatment with referral cases taken to Kakuma Mission Hospital."",""Police officers on the ground told Citizen Digital that they suspect a student who had just been suspended went and gathered members of an outlawed militia and then stormed the school, killing seven people among them six students and watchman."",""The student is reported to have allegedly been in the company of members of the outlawed militia when they attacked the school."",""More to follow..""]",citizentv.co.ke/news/seven-killed-in-lokichogio-school-attack-178392,13-10-17 20:00,Kenya
98890,Triple suicide bombing kills 26 in north Cameroon market,"[""At least 26 people were killed on Monday when three suicide bombers blew themselves up at a market in the far north of Cameroon, a region often targeted by Nigeria’s Boko Haram. "",""Police said the assailants hit a local market in Bodo village near the frontier with Nigeria in one of the most deadly attacks in the Far North since 2013. "",""“An initial toll shows 29 dead and around 30 injured,” a police source told AFP, speaking on condition of anonymity and saying the toll included the three suicide bombers."",""Nearly 1,200 people have been killed since 2013 when Boko Haram began attacking Cameroon’s Far North, an area which borders the Islamist group’s stronghold in northeastern Nigeria. "",""“In total, 1,098 civilians, 67 of our soldiers and three police officials have been killed in these barbaric attacks by the Boko Haram terrorist group,” Communications Minister Issa Chiroma Bakary said earlier this month. "",""In that time, officials say there have been more than 30 suicide attacks blamed on Boko Haram, which has pledged allegiance to the Islamic State (IS) group."",""This year, there have been attacks on an almost daily basis, some of which have been backed by incursions."",""Last week, four worshippers were killed in a suicide bombing at a mosque in the northern village of Nguetchewe, just days after a similar attack on another mosque in the Far North killed 12."",""In recent years, Boko Haram fighters have slipped back and forth across the frontier, often using Cameroon’s remote north as a rear base, acquiring arms, vehicles and supplies there."",""But since late November, the Cameroon army has carried out operations in several border areas aimed at weakening Nigerian jihadists active in the region, with sources saying the raids have significantly weakened Boko Haram’s capabilities. "",""As a result, the insurgents have turned away from direct confrontation with the military in favour of suicide attacks, increasingly staged by women and girls."",""– Increasing cross-border attacks –"",""The Nigeria-based jihadists have killed at least 17,000 people and made more than 2.6 million others homeless since their six-year campaign began."",""Boko Haram, facing the heat of a military onslaught back home, has in the past year stepped up cross-border attacks in Niger, Chad and Cameroon while continuing shooting and suicide assaults on markets, mosques and other mostly civilian targets within Nigeria itself. "",""The group has increasingly targeted imams and traditional chiefs for their opposition to the Islamists."",""Cameroon has meanwhile banned the Islamic veil in a bid to pre-empt suicide bombings staged by attackers wearing the full-face veil. "",""Along with Nigeria, Niger, Chad and Benin, Cameroon is part of a regional military force fighting the jihadists. "",""Despite the offensives launched by the regional force, the group maintains strongholds in areas that are difficult to access, such as the Sambisa forest, the Mandara mountains and the numerous islands of Lake Chad.""]",guardian.ng/news/triple-suicide-bombing-kills-26-in-north-cameroon-market,24-01-16 19:00,Nigeria
