Column1,title,text,url
339287,"Somali pirates hijack Comoros-flagged ship with 29 people on board, including 20 passengers","[""NAIROBI, Kenya (AP) - The European Union's anti-piracy naval force says Somali pirates have hijacked a Comoros-flagged ship on its way to Tanzania."",""The EU force says the Aly Zoulfecar was seized Wednesday en route to the Tanzanian port city of Dar es Salaam with 29 people on board."",""The EU force said late Wednesday that the ship has 20 passengers -- 12 from Tanzania and eight from Comoros."",""Somali pirates usually seize ships in the Gulf of Aden, one of the world's busiest waterways."",""However, patrols by an international flotilla has decreased successful hijackings in the gulf and forced the pirates farther south."",""Somalia has not had an effective government for 19 years, one of the reasons piracy has been able to flourish.""]","ap.com/Somali pirates hijack Comoros-flagged ship with 29 people on board, including 20 passengers"
65163,Gunmen abduct Anglican bishop in Rivers,"[""Gunmen have kidnapped the Bishop of Ahoada Anglican Diocese in Rivers State, Clement Ekpeye."",""A source in the church told The Guardian that Ekpeye was kidnapped at his Bishop’s Court residence in Ahoada."",""It was gathered at press time that the gunmen had not made any contact with his family."",""Police in Rivers State are said to have begun manhunt for the abductors and possibly rescue him from them. "",""The State Police Command spokesperson, Nnamdi Omoni, said effort was being made by security agents to rescue the Bishop. ""]",guardian.ng/news/gunmen-abduct-anglican-bishop-in-rivers
166085,12 schools attacked in one night by unknown assailants,"[""Twelve schools were attacked overnight by unknown assailants in Pakistan’s northern Gilgit Baltistan region, raising fears of increasing extremism in a relatively peaceful area, officials said Friday."",""Officials said no one was hurt in the incidents, in which attackers mainly targeted girls’ schools in a tourist region on the Chinese border famed for its high peaks."",""“The miscreants tried to damage around 12 schools in Diamir district. They tried to set fire to some of them and broke windows and doors of some others,” regional home secretary Jawad Akram told AFP."",""READ ALSO: 2019: Defections won’t stop Buhari’s re-election – Tony Momoh"",""Akram said the local government had begun searching for the attackers."",""Dildar Ahmed Malik, a senior official in Diamir district, said at least 10 of the burnt schools were for girls."",""“The incident took place in a far-flung area. We are investigating it, but the inquiry will take time because of the remoteness of the region,” he said."",""Gilgit Baltistan has been relatively free of the violent militancy that has plagued other parts of Paksitan for years."",""The region is home to world’s second highest mountain, K2, and numerous other peaks attracting mountaineers and tourists from around the world."",""Like many other under-developed areas of Pakistan, basic education needs in Gilgit Baltistan are being met by private or community organisations, and a large number of primary schools have been set up by non-government organisations."",""Education is a pressing issue in Pakistan, where government statistics show that more than 22 million children are out of school — the majority of them girls."",""(AFP)""]",punchng.com/%2a/12-schools-attacked-in-one-night-by-unknown-assailants
108177,Afghanistan kidnap: Gunmen seize 30 Hazara men in Zabul,"[""MASKED gunmen in southern Afghanistan have abducted 30 men from the Hazara ethnic minority, officials say."",""The men were travelling by bus from Iran when they were seized in Zabul province, on the road to Kabul."",""No group has said it carried out the abductions. Kidnappings for ransom are common in Afghanistan."",""Unlike in Pakistan, Afghan Hazaras, who are mostly Shia Muslims, have been largely spared attacks by Sunni militants operating in both countries."",""Eye-witnesses say gunmen wearing masks and black clothes forced a convoy of two buses to stop in Zabul province, on the road between Kandahar and the capital."",""They took the men away but left behind women and children travelling with them."",""The passengers had travelled from Iran, via the western Afghan city of Herat.""]",guardian.ng/news/world/afghanistan-kidnap-gunmen-seize-30-hazara-men-in-zabul
339122,"Somali pirates seize cargo ship with Filipino, Romanian crew; release a different vessel","[""NAIROBI, Kenya (AP) - Somali pirates seized a ship with eight crew onboard, the European Union Naval Force said Tuesday, but released another vessel."",""The MV EMS River was seized approximately 175 miles (280 kilometers) northeast of the port of Salalah, Oman, said Wing Cmdr. Paddy O'Kennedy. The pirates have been extending their range south and east in response to increased naval patrols off the Somali coast."",""The general cargo ship has a crew of one Romanian and seven Filipinos, the EU force said. The ship is German owned and was carrying petrol from Greece to the United Arab Emirates."",""Another pirated vessel, the MV Motivator, was close by during Monday's attack. Kennedy said that the presence of the other ship so close shows pirates are using larger pirated vessels as 'motherships' to extend their range. Several other recent attacks have also used pirated ships to help extend the range of the small speedboats the pirates used."",""In a separate development, pirates released the MV Marida Marguerite and its 22 crew. The German-owned vessel was taken on May 8 while traveling to Holland."",""The European Union Naval Force says there are now 25 vessels and 587 hostages being held by pirates off the coast of Somalia."",""The arid Horn of Africa nation has not had a functioning government since 1991 and the multimillion dollar ransoms represent one of the few ways for Somalis to make money. Somalia's long coastline offers many havens for pirates, who continue to prey on one of the world's most important shipping lanes.""]","ap.com/Somali pirates seize cargo ship with Filipino, Romanian crew; release a different vessel"
163669,"Two British tourists, five others injured in Paris knife attack","[""Seven people including two British tourists were injured in Paris late Sunday by a knife-wielding man, a terrifying attack that bystanders tried to stop by throwing petanque balls at the assailant."",""Four of the victims were in a critical condition, police said, after the man brandishing a large blade and and iron bar went on the rampage next to a canal in the northeast of the capital."",""READ ALSO: That crackdown on MTN, four banks"",""The suspect is believed to be an Afghan national and has been arrested, said a source close to the enquiry, adding he had targeted “strangers” but that “nothing at this stage shows signs of a terrorist nature”."",""Chaos erupted on the banks of the Bassin de la Villette, an area popular with locals and visitors who frequent the cafes, cinemas and other cultural venues along its banks, just after 11:00pm (2100 GMT)."",""Eyewitness Youssef Najah, 28, said he was walking beside the canal when he saw a man running and holding a knife about 25-30 cm (10-11 inches) long."",""“There were around 20 people chasing him. They started throwing petanque balls at him,” Najah said, referring to the sport popular in France also known as boules."",""“Around four or five balls hit him in the head, but they weren’t able to stop him,” he added."",""According to the same witness, the attacker then dived into an alleyway, where the man “tried to hide behind two British tourists. We said to them: ‘Watch out, he has a knife”. But they didn’t react”."",""The pair were then attacked, he said."",""A security guard at one of two cinemas on either side of the water said he had seen the attacker running away from two men who were trying to stop him."",""“He had an iron bar in his hand which he threw at the men chasing him, then he took out a knife,” he told AFP."",""The UK foreign office said it was aware of reports of the attack and was “urgently investigating this incident” in cooperation with French authorities, British media reported."",""– High alert –"",""A police investigation has been launched for attempted murder, according to a judicial source."",""It is the latest of several knife attacks France has seen in recent months, with terrorism being ruled out in most cases."",""On August 23, a man stabbed his mother and sister to death and seriously injured another person in a town near Paris before being shot dead by police."",""READ ALSO: FG releases N9bn for 550 low-cost houses"",""The motive for the violence remained unclear despite a claim by the Islamic State (IS) group that it was an attack by one of its fighters responding to the terror organisation’s propaganda."",""Authorities said the 36-year-old had serious mental health problems and had been on a terror watch list since 2016."",""That attack came days after an Afghan asylum-seeker was arrested in town of Perigueux for a drunken rampage with a knife in which four people were wounded, one seriously."",""Police said investigators had “very quickly” dismissed a terrorist motive after the August 13 incident."",""And on June 17, two people were hurt in another southern town when a woman shouting “Allahu akbar” (God is greatest) attacked them in a supermarket with a boxcutter knife."",""France has been on high alert following a string of jihadist attacks in recent years, often by people who have become radicalised or claim to have acted in the name of the IS group."",""More than 240 people have been killed by Islamist extremists since a massacre at the Charlie Hebdo satirical magazine in Paris in January 2015."",""(AFP)""]",punchng.com/two-british-tourists-five-others-injured-in-paris-knife-attack
123719,Suspected hoodlums invade Ibrahim’s campaign office,"[""Hoodlums, suspected to be political thugs, have attacked the campaign office of a factional Peoples Democratic Party (PDP) governorship candidate in Ondo State, Dr. Jimoh Ibrahim."",""The campaign office on Oyemekun Road, Akure, was ransacked and the party’s flags representing the 18 local councils of the state and country were lacerated."",""Also, the large billboard of the candidate was pulled off the wall of the one-storey building while pieces of the banner and the party’s flags littered the premises."",""Director of Publicity of Jimoh Ibrahim Campaign Organisation, Sola Akinuli, described the attack as unfortunate."",""Also, Director of Media and Publicity of the faction, Mr. Yemi Akintomide, condemned the act as barbaric and a high level of political intolerance, bitterness and wickedness.""]",guardian.ng/news/suspected-hoodlums-invade-ibrahims-campaign-office
14886,Nigerian gunmen hijack oil supply vessel in delta,"[""LAGOS, Aug 25 (Reuters) - Gunmen hijacked an oil supply boat with eight Nigerian crew members, the latest attack in Nigeria’s restive Niger Delta region, military and private security sources said on Monday."",""The “Benue,” belonging to local oil services company West Africa Offshore (WAO) was returning from the Agbami offshore oil field operated by U.S. major Chevron (CVX.N) to Onne in Rivers state when it was seized on Sunday, one private security source working in the oil industry told Reuters."",""The Agbami field, which started production in July at 20,000 barrels per day, is expected to ramp up to around 100,000 bpd by February and hit its plateau of 250,000 bpd by the end of next year."",""“WAO Benue, a supply boat returning from Agbami field to Onne port, was hijacked along the Port Harcourt channel at about 1440 GMT hours (on Sunday),” the security source said."",""Lieutenant Colonel Sagir Musa, spokesman for the military task force in Rivers state, confirmed the hijacking but did not immediately have details."",""No group has yet to claim responsibility for the attack."",""Insecurity in the vast wetlands region surged in early 2006 when militants, who say the are fighting for more local control of the impoverished region’s oil wealth, started blowing up oil pipelines and kidnapping foreign oil workers."",""Criminal gangs have taken advantage of the breakdown in law and order and the instability has become as much about control of a lucrative trade in stolen oil and abductions for ransom as about political struggle."",""The latest hijacking came barely three months after gunmen in May seized another supply vessel, MV Lourdes Tide, working for Chevron, and demanded a 30 million naira ($254,539) ransom for the release of the boat and its 11-man crew, who included one Portuguese and one Ukrainian."",""The Lourdes Tide, operated by oil services firm Tidewater Nigeria Ltd (TDW.N), was carrying supplies from Onne to Escravos in neighbouring Delta state when it was attacked.  (For full Reuters Africa coverage and to have your say on the top issues, visit: africa.reuters.com/ )  (Reporting by Tume Ahemba; Editing by Randy Fabi and Mary Gabriel)""]",reuters.com/article/2008/08/25/nigeria-delta-hijack-idUSLP69721020080825
420331,"Teargas, chaos as Kenyatta to be sworn in for disputed second term","[""Kenyan police fired teargas and clashed with both ruling party and opposition supporters Tuesday ahead of the swearing in as president of Uhuru Kenyatta after two disputed polls that have left the nation deeply divided."",""As foreign and local dignitaries poured into the 60,000-seat Kasarani stadium in Nairobi where the ceremony is to be held, the opposition attempted to gather for a \""memorial rally\"" honouring the more than 50 people killed, mostly by police, in four months of political upheaval."",""However police fired volleys of teargas and beat opposition supporters, prompting running battles in the area, an AFP reporter said."",""Meanwhile at the Kasarani stadium chaos erupted as a crowd attempted to force its way into the venue, prompting police to fire teargas at Kenyatta supporters who tried to fight their way in."",""\""I just want to see President Uhuru Kenyatta because I voted for him, why are we being beaten like NASA (opposition),\"" said Janet Wambua, who was among the angry crowd."",""Joseph Irungu of the interior ministry planning committee had said there was space for 40,000 people who did not get in to watch the event on big screens outside the stadium. However no such screens were provided, further angering the crowd."",""Around 13 mostly African heads of state are expected to attend the ceremony where Kenyatta, 56, will be sworn in for his second and final five-year term."",""These include the presidents of South Sudan, Uganda, Rwanda, Zambia and Somalia -- among others -- while prime ministers, foreign ministers and special envoys will represent other African nations, as well as Qatar, the United Arab Emirates, Ukraine and Serbia."",""- Two elections and a historic court case -"",""Kenyatta's inauguration comes after the Supreme Court validated his victory in last month's rerun poll."",""However, the swearing-in may not draw a line under the country's political crisis with Odinga vowing to fight on."",""The electoral strife goes back to an August 8 poll that was annulled in September by the Supreme Court, citing \""irregularities and illegalities\""."",""The court ordered a rerun in October that was boycotted by the opposition, handing Kenyatta a landslide of 98 percent of votes cast by just 39 percent of the electorate."",""The disputed election season has split the country along ethnic and regional lines, although political violence has not reached the scale of that which followed a 2007 poll when 1,100 were killed."",""Odinga, denied the presidency for a fourth time this year, believes that he was cheated and the 72-year-old has refused to recognise the result."",""He has promised to found a \""third republic\"" -- following independence from Britain in 1963 and a new constitution adopted in 2010 -- as well as to continue a programme of protests and economic boycotts aimed at undermining Kenyatta's \""dictatorship\""."",""The current political crisis draws on a deep well of social, ethnic and geographic grievances in the country of around 48 million people."",""In areas loyal to Odinga, an ethnic Luo, there is a sense of having been ground down and discriminated against since independence, not least by Kenyatta's Kikuyu group, which has given Kenya three of its four presidents."",""The months of disruption and unrest, plus the holding of two separate elections, have badly affected the economy, hitting the poorest hardest while leaving the wealthy political elites relatively unharmed.""]",thecitizen.co.tz/news/1840386-4205796-jy5ou4
360876,"2 Chinese miners kidnapped by gunmen in Nigeria, police say","[""WARRI, Nigeria (AP) — Police say gunmen have kidnapped two Chinese miners in central Nigeria."",""Police say local hunters and others are helping them in \""a very intense search\"" for the miners in the forest and bush of Nasarawa state."",""Assistant police superintendent Numan Ismaila says gunmen ambushed the vehicle carrying the miners Friday afternoon on the road to Abuja, the capital."",""They work for Chinese company West African Polaris Ltd., which mines tin and columbite."",""Kidnappings of foreigners and locals are common all over Nigeria. Victims usually are returned unharmed once a ransom is paid.""]","ap.com/2 Chinese miners kidnapped by gunmen in Nigeria, police say"
337642,Gunmen kidnap 2 more foreigners in Nigeria's southern oil-producing region,"[""LAGOS, Nigeria (AP) - Gunmen seized two foreign workers Monday in Nigeria's southern oil-producing region, officials said, the latest kidnappings in an area where nearly 70 foreigners have been taken since the beginning of the year.   "",""The attackers snatched the men from their work compound in southern Bayelsa state, said Godknows Igali, a government negotiator in the region.   "",""A colleague of the two construction workers said they were Lebanese. The pair were taken after a prolonged gunbattle, but there were no casualties reported, said the colleague, who spoke on condition of anonymity because of company restrictions on dealings with the media.   "",""On Saturday, gunmen kidnapped a British oil worker from an offshore oil rig in Nigeria's oil-rich but impoverished Niger River delta region. A Dutch construction worker and two Chinese also remain in captivity.   "",""Some of the kidnappers make political demands, including the release of an ex-governor on trial for corruption and a former militant leader charged with treason. Other gangs demand large cash payments. Most kidnapped foreigners are released unharmed.   "",""Many of the groups enjoy protection from local politicians who are suspected of using them as hired labor to help rig elections scheduled for next month.   "",""Though Nigeria's oil wealth generates tens of billions of dollars every year, the majority of Nigerians remain mired in poverty. Throughout the delta region, poor villagers without access to clean water or electricity live side by side with multimillion-dollar oil installations.   "",""Nigeria, Africa's largest oil producer, is also rated one of the most corrupt countries in the world by Berlin-based watchdog Transparency International.   ""]",ap.com/Gunmen kidnap 2 more foreigners in Nigeria's southern oil-producing region
70961,Kenyan police accused of rape in election violence,"[""Kenyan security forces raped, beat and assaulted civilians during violence in recent elections, Human Rights Watch said Thursday."",""“There was widespread sexual violence against women and girls, and sexual attacks on men,” HRW said, in a report titled, “They were men in uniform.”"",""The violence, documented during Kenya’s election in August by HRW and other rights groups, recorded “police use of excessive force against protesters, killings, beatings and maiming of individuals, looting and destruction of property.”"",""The report was based on interviews with 65 women, three girls and three men who were sexually attacked. About half of rapes reported to HRW were gang rapes."",""“About half of the women interviewed said that they were raped by policemen or men in uniform,” the report read, adding that many attacks were also accompanied by torture and violence against the women’s children and husbands."",""At least 58 people have died during violent clashes since the August vote, which split the country along ethnic and regional lines."",""The August 8 poll that was annulled in September by the Supreme Court, citing “irregularities and illegalities”."",""The court ordered a rerun in October that was boycotted by the opposition, handing President Uhuru Kenyatta a landslide of 98 percent of votes cast by just 39 percent of the electorate.""]",guardian.ng/news/kenyan-police-accused-of-rape-in-election-violence
93696,Several migrants attacked by mob in Cologne: German police,"[""A group of Pakistanis and a Syrian were violently attacked by about 20 unknown assailants late Sunday in the German city of Cologne, police said."",""With tensions running high over more than 500 reported assaults against women on New Year’s Eve in the western city blamed on migrants, police said Monday that the mob attacked six Pakistanis, two of whom had to be hospitalised."",""Shortly afterward, a group of five people attacked a 39-year-old Syrian national, injuring him slightly."",""Sunday’s violence, in the city centre outside the main railways station marked a new escalation since the rash of assaults occurred during year-end celebrations."",""Police on Sunday said they had received reports of “groups of people seeking to provoke” and dispatched reinforcements to the area between the station and the city’s iconic Gothic cathedral."",""Officers checked the identification of about 100 people and two were detained for refusing to obey police orders."",""On Saturday, police used tear gas and water cannon to clear a rally of the far-right PEGIDA movement in Cologne, after protesters flung firecrackers and bottles at officers they accused of failing to prevent assaults during New Year’s festivities. "",""Police said late Sunday that more than a week on from New Year’s Eve, some 516 complaints had now been lodged, including 40 percent that are related to sexual assault."",""Witnesses described terrifying scenes of hundreds of women running a gauntlet of groping hands, lewd insults and robberies in the mob violence."",""The scale of the Cologne assaults has shocked Germany and put a spotlight on the 1.1 million asylum seekers who arrived in the country last year.  ""]",guardian.ng/news/several-migrants-attacked-by-mob-in-cologne-german-police
359613,"Gunmen kidnap 3 teachers at Kenya refugee camp, police say","[""NAIROBI, Kenya (AP) — Gunmen have kidnapped three Kenyan teachers from the world's largest refugee camp, police said Thursday."",""Three men with pistols abducted the teachers with the Udha Academy in the Hagadera section of Dadaab refugee camp, according to a police report seen by The Associated Press. The camp in eastern Kenya holds more than 200,000 Somali refugees."",""Mohamud Saleh, the northeastern regional security coordinator, said security forces cordoned off the area and sealed the route into neighboring Somalia, where the gunmen are suspected to have come from."",""No group has claimed responsibility for the latest kidnapping from the camp."",""Kenyan authorities have expressed interest in closing Dadaab, claiming it has become a recruitment and training ground for Somalia's extremist group al-Shabab. But authorities have not provided proof, and a court recently blocked a plan to close the camp at the end of May."",""\nAl-Shabab has carried out several attacks in Kenya, including the April 2015 assault on Garissa University in which 148 people were killed. The extremist group has vowed retribution on Kenya for sending troops to Somalia to fight it."",""Kenyan government blamed al-Shabab for the kidnapping of two Spanish aid workers from Dadaab camp in October 2011 and said that incident and other cross-border attacks led to its decision to send troops to Somalia. The workers were released after 21 months in captivity."",""In June 2012, four international aid workers were kidnapped from Dadaab in an attack that saw a Kenyan driver killed. They were rescued days later. The attack also was blamed on al-Shabab.""]","ap.com/Gunmen kidnap 3 teachers at Kenya refugee camp, police say"
340372,"Official: Radical Muslim sect attacks army patrol in northeast Nigeria, wounding 4","[""MAIDUGURI, Nigeria (AP) - Authorities say suspected members of a radical Muslim sect attacked an army patrol in northeast Nigeria, wounding four soldiers."",""Col. Victor Ebhaleme said the shooting took place Tuesday night in Maiduguri, a city that once housed the main mosque of the sect known locally as Boko Haram. Ebhaleme said soldiers later arrested 15 people on suspicion of being sect members, with some of them carrying weapons and ammunition."",""Boko Haram, whose name means \""Western education is sacrilege\"" in the local Hausa language, wants the strict implementation of Shariah law in Nigeria. The sect claimed responsibility for the Aug. 26 car bombing of the United Nations headquarters in Nigeria that killed at least 23 people and wounded 81."",""Separately in southwest Nigeria, a shootout Wednesday between police and armed robbers left one officer wounded.""]","ap.com/Official: Radical Muslim sect attacks army patrol in northeast Nigeria, wounding 4"
